,ner_id,link,title,doi
1176,4432,/doi/10.1145/1294046.1294123,A multimodal guide for the augmented campus,https://doi.org/10.1145/1294046.1294123
1177,4433,/doi/10.1109/ICSC.2007.95,Sub-Symbolic Semantic Layer in Cyc for Intuitive Chat-Bots,https://doi.org/10.1109/ICSC.2007.95
1178,4434,/doi/10.1007/11565123_52,Latent semantic description of iconic scenes,https://doi.org/10.1007/11565123_52
1179,4435,/doi/10.1007/11558590_39,A conversational agent based on a conceptual interpretation of a data driven semantic space,https://doi.org/10.1007/11558590_39
1180,4437,/doi/10.1007/11558590_37,Learning path generation by domain ontology transformation,https://doi.org/10.1007/11558590_37
1181,4439,/doi/10.1109/CAMP.2005.8,A Sub-Symbolic Approach to Word Modelling for Domain Specific Speech Recognition,https://doi.org/10.1109/CAMP.2005.8
1182,4440,/doi/10.1007/11504894_43,A geometric approach to automatic description of iconic scenes,https://doi.org/10.1007/11504894_43
1183,4441,/doi/10.1007/11504894_42,Discovering learning paths on a domain ontology using natural language interaction,https://doi.org/10.1007/11504894_42
1184,4443,/doi/10.1007/11731177_21,Application of Eαnets to feature recognition of articulation manner in knowledge-based automatic speech recognition,https://doi.org/10.1007/11731177_21
1185,4448,/doi/10.1007/11731177_17,Automatic dictionary creation by sub-symbolic encoding of words,https://doi.org/10.1007/11731177_17
1186,4450,/doi/10.1007/s00778-020-00650-5,Cache-efficient sweeping-based interval joins for extended Allen relation predicates,https://doi.org/10.1007/s00778-020-00650-5
1187,4454,/doi/10.1109/IRI.2018.00085,How to Exploit Recommender Systems in Social Media,https://doi.org/10.1109/IRI.2018.00085
1188,4456,/doi/10.1016/j.cose.2017.06.002,Recognizing human behaviours in online social networks,https://doi.org/10.1016/j.cose.2017.06.002
1189,4460,/doi/10.1145/3132847.3133164,An Interactive Framework for Video Surveillance Event Detection and Modeling,https://doi.org/10.1145/3132847.3133164
1190,4462,/doi/10.1109/IRI.2017.84,A Collaborative Robotic Cyber Physical System for Surgery Applications,https://doi.org/10.1109/IRI.2017.84
1191,4463,/doi/10.1109/IRI.2017.74,A Survey of Online Social Networks: Challenges and Opportunities,https://doi.org/10.1109/IRI.2017.74
1192,4464,/doi/10.4018/IJMDEM.2016100101,"ISEQL, an Interval-based Surveillance Event Query Language",https://doi.org/10.4018/IJMDEM.2016100101
1193,4465,/doi/10.1109/IRI.2016.72,An Event Detection Framework Supported by a Smart Graphical User Interface,https://doi.org/10.1109/IRI.2016.72
1194,4466,/doi/10.1109/3PGCIC.2015.113,A Distributed Framework for Event Detection in Video Surveillance Context,https://doi.org/10.1109/3PGCIC.2015.113
1195,4467,/doi/10.1109/IRI.2015.81,A Low-Cost Haptic System for Wrist Rehabilitation,https://doi.org/10.1109/IRI.2015.81
1196,4469,/doi/10.5220/0005579703440353,A Novel Approach to Query Expansion based on Semantic Similarity Measures,https://doi.org/10.5220/0005579703440353
1197,4471,/doi/10.5220/0005146504460453,Discovering Expected Activities in Medical Context Scientific Databases,https://doi.org/10.5220/0005146504460453
1198,4472,/doi/10.1109/ICSC.2014.21,Detecting Unexplained Human Behaviors in Social Networks,https://doi.org/10.1109/ICSC.2014.21
1199,4473,/doi/10.1109/TKDE.2013.33,Discovering the Top-k Unexplained Sequences in Time-Stamped Observation Data,https://doi.org/10.1109/TKDE.2013.33
1200,4477,/doi/10.1007/978-3-319-03889-6_15,PSIS: Parallel Semantic Indexing System - Preliminary Experiments,https://doi.org/10.1007/978-3-319-03889-6_15
1201,4478,/doi/10.1145/2532640,A Multimedia Recommender System,https://doi.org/10.1145/2532640
1202,4480,/doi/10.1109/ICSC.2013.76,An RDF-Based Framework for Semantic Indexing of Web Pages,https://doi.org/10.1109/ICSC.2013.76
1203,4481,/doi/10.1109/ICSC.2012.13,iWIN: A Summarizer System Based on a Semantic Analysis of Web Documents,https://doi.org/10.1109/ICSC.2012.13
1204,4484,/doi/10.4018/jmdem.2011100101,A Novel Strategy for Recommending Multimedia Objects and its Application in the Cultural Heritage Domain,https://doi.org/10.4018/jmdem.2011100101
1205,4485,/doi/10.1109/ICSC.2011.47,A Multimedia Semantic Recommender System for Cultural Heritage Applications,https://doi.org/10.1109/ICSC.2011.47
1206,4486,/doi/10.1145/1864708.1864779,Modeling recommendation as a social choice problem,https://doi.org/10.1145/1864708.1864779
1207,4487,/doi/10.1109/ICSC.2010.28,Semantic Summarization of Web Documents,https://doi.org/10.1109/ICSC.2010.28
1208,4488,/doi/10.1145/1816041.1816087,A ranking method for multimedia recommenders,https://doi.org/10.1145/1816041.1816087
1209,4489,/doi/10.1109/ICSC.2009.25,A System for Automatic Image Categorization,https://doi.org/10.1109/ICSC.2009.25
1210,4491,/doi/10.1016/j.is.2018.08.002,Interactive and space-efficient multi-dimensional time series subsequence matching,https://doi.org/10.1016/j.is.2018.08.002
1211,4493,/doi/10.1145/3603719.3603732,Indexing Temporal Relations for Range-Duration Queries,https://doi.org/10.1145/3603719.3603732
1212,4496,/doi/10.1145/3609956.3609968,A New Primitive for Processing Temporal Joins,https://doi.org/10.1145/3609956.3609968
1213,4500,/doi/10.1145/3511808.3557161,CAVE: Correcting Attribute Values in E-commerce Profiles,https://doi.org/10.1145/3511808.3557161
1214,4503,/doi/10.1007/978-3-031-15740-0_5,What’s New in Temporal Databases?,https://doi.org/10.1007/978-3-031-15740-0_5
1215,4504,/doi/10.1007/978-3-031-15740-0_16,Querying Temporal Anomalies in Healthcare Information Systems and Beyond,https://doi.org/10.1007/978-3-031-15740-0_16
1216,4507,/doi/10.14778/3565838.3565840,Fast and Scalable Mining of Time Series Motifs with Probabilistic Guarantees,https://doi.org/10.14778/3565838.3565840
1217,4508,/doi/10.1016/j.ins.2022.03.017,Enumerating dissimilar minimum cost perfect and error-correcting bipartite matchings for robust data matching,https://doi.org/10.1016/j.ins.2022.03.017
1218,4510,/doi/10.1007/s00778-021-00692-3,Leveraging range joins for the computation of overlap joins,https://doi.org/10.1007/s00778-021-00692-3
1219,4514,/doi/10.1007/978-3-030-54832-2_2,Processing Temporal and Time Series Data: Present State and Future Challenges,https://doi.org/10.1007/978-3-030-54832-2_2
1220,4515,/doi/10.1145/3340964.3340989,HotPeriods: Visual Correlation Analysis of Interval Data,https://doi.org/10.1145/3340964.3340989
1221,4518,/doi/10.1145/3340964.3340965,Period Index: A Learned 2D Hash Index for Range and Duration Queries,https://doi.org/10.1145/3340964.3340965
1222,4524,/doi/10.1007/s00778-019-00544-1,Comparing heuristics for graph edit distance computation,https://doi.org/10.1007/s00778-019-00544-1
1223,4527,/doi/10.1007/978-3-030-20081-7_2,GEDLIB: A C++ Library for Graph Edit Distance Computation,https://doi.org/10.1007/978-3-030-20081-7_2
1224,4528,/doi/10.1016/j.is.2018.06.009,Sparse prefix sums: Constant-time range sum queries over sparse multidimensional data cubes,https://doi.org/10.1016/j.is.2018.06.009
1225,4530,/doi/10.14778/3311880.3311882,Snapshot semantics for temporal multiset relations,https://doi.org/10.14778/3311880.3311882
1226,4533,/doi/10.1145/3274895.3274903,Finding k-dissimilar paths with minimum collective length,https://doi.org/10.1145/3274895.3274903
1227,4536,/doi/10.1007/978-3-319-97785-0_28,Ring Based Approximation of Graph Edit Distance,https://doi.org/10.1007/978-3-319-97785-0_28
1228,4537,/doi/10.14778/3137628.3137658,DigitHist: a histogram-based data summary with tight error bounds,https://doi.org/10.14778/3137628.3137658
1229,4538,/doi/10.1145/3085504.3091115,VISOR: Visualizing Summaries of Ordered Data,https://doi.org/10.1145/3085504.3091115
1230,4539,/doi/10.1145/3085504.3085538,Computing Isochrones in Multimodal Spatial Networks using Tile Regions,https://doi.org/10.1145/3085504.3085538
1231,4543,/doi/10.1007/978-3-319-58961-9_19,Exact Computation of Graph Edit Distance for Uniform and Non-uniform Metric Edit Costs,https://doi.org/10.1007/978-3-319-58961-9_19
1232,4544,/doi/10.1145/2967608,Extending the Kernel of a Relational DBMS with Comprehensive Support for Sequenced Temporal Queries,https://doi.org/10.1145/2967608
1233,4545,/doi/10.1145/2996913.2997007,MoTrIS: a framework for route planning on multimodal transportation networks,https://doi.org/10.1145/2996913.2997007
1234,4548,/doi/10.1109/TCBB.2015.2456897,Fast Sampling-Based Whole-Genome Haplotype Block Recognition,https://doi.org/10.1109/TCBB.2015.2456897
1235,4551,/doi/10.1145/2820783.2820858,Alternative routing: k-shortest paths with limited overlap,https://doi.org/10.1145/2820783.2820858
1236,4552,/doi/10.1145/2666310.2666411,Efficient itinerary planning with category constraints,https://doi.org/10.1145/2666310.2666411
1237,4556,/doi/10.1145/2588555.2612175,Overlap interval partition join,https://doi.org/10.1145/2588555.2612175
1238,4557,/doi/10.1007/978-3-642-40131-2_5,Efficient Evaluation of Ad-Hoc Range Aggregates,https://doi.org/10.1007/978-3-642-40131-2_5
1239,4559,/doi/10.1109/ICDE.2013.6544930,Query time scaling of attribute values in interval timestamped databases,https://doi.org/10.1109/ICDE.2013.6544930
1240,4560,/doi/10.1007/978-3-642-37087-8_13,ISOGA: a system for geographical reachability analysis,https://doi.org/10.1007/978-3-642-37087-8_13
1241,4562,/doi/10.1145/2396761.2398739,MOUNA: mining opinions to unveil neglected arguments,https://doi.org/10.1145/2396761.2398739
1242,4563,/doi/10.1109/DEXA.2012.51,Individualized Hiking Time Estimation,https://doi.org/10.1109/DEXA.2012.51
1243,4566,/doi/10.1145/2339530.2339607,Efficient event pattern matching with match windows,https://doi.org/10.1145/2339530.2339607
1244,4568,/doi/10.1007/s00778-011-0254-6,Windowed pq-grams for approximate joins of data-centric XML,https://doi.org/10.1007/s00778-011-0254-6
1245,4571,/doi/10.1007/978-3-642-31235-9_35,Scalable computation of isochrones with network expiration,https://doi.org/10.1007/978-3-642-31235-9_35
1246,4572,/doi/10.1007/s00778-011-0243-9,Parsimonious temporal aggregation,https://doi.org/10.1007/s00778-011-0243-9
1247,4574,/doi/10.1145/2213836.2213886,Temporal alignment,https://doi.org/10.1145/2213836.2213886
1248,4575,/doi/10.1145/2063576.2063972,Defining isochrones in multimodal spatial networks,https://doi.org/10.1145/2063576.2063972
1249,4577,/doi/10.1145/2063576.2063594,Diversifying search results of controversial queries,https://doi.org/10.1145/2063576.2063594
1250,4578,/doi/10.1007/s00778-011-0247-5,Sequenced spatiotemporal aggregation for coarse query granularities,https://doi.org/10.1007/s00778-011-0247-5
1251,4580,/doi/10.1016/j.is.2010.07.005,θ-Constrained multi-dimensional aggregation,https://doi.org/10.1016/j.is.2010.07.005
1252,4583,/doi/10.1145/1951365.1951372,Sequenced event set pattern matching,https://doi.org/10.1145/1951365.1951372
1253,4584,/doi/10.1145/1871437.1871761,Ranking of evolving stories through meta-aggregation,https://doi.org/10.1145/1871437.1871761
1254,4587,/doi/10.1007/978-3-642-04840-1_20,Evaluating Exceptions on Time Slices,https://doi.org/10.1007/978-3-642-04840-1_20
1255,4589,/doi/10.1145/1516360.1516475,Parsimonious temporal aggregation,https://doi.org/10.1145/1516360.1516475
1256,4590,/doi/10.1145/1516360.1516368,Sequenced spatio-temporal aggregation in road networks,https://doi.org/10.1145/1516360.1516368
1257,4591,/doi/10.1145/1463434.1463524,"Computing isochrones in multi-modal, schedule-based transport networks",https://doi.org/10.1145/1463434.1463524
1258,4596,/doi/10.1007/978-3-540-70504-8_27,Towards General Temporal Aggregation,https://doi.org/10.1007/978-3-540-70504-8_27
1259,4597,/doi/10.1109/TIME.2008.26,Representing Public Transport Schedules as Repeating Trips,https://doi.org/10.1109/TIME.2008.26
1260,4598,/doi/10.1109/TIME.2008.24,A Greedy Approach Towards Parsimonious Temporal Aggregation,https://doi.org/10.1109/TIME.2008.24
1261,4599,/doi/10.1109/ICDE.2008.4497490,Approximate Joins for Data-Centric XML,https://doi.org/10.1109/ICDE.2008.4497490
1262,4600,/doi/10.1145/1670243.1670247,The pq-gram distance between ordered labeled trees,https://doi.org/10.1145/1670243.1670247
1263,4601,/doi/10.1109/TIME.2006.17,How Would You Like to Aggregate Your Temporal Data?,https://doi.org/10.1109/TIME.2006.17
1264,4602,/doi/10.1007/11687238_18,Multi-dimensional aggregation for temporal data,https://doi.org/10.1007/11687238_18
1265,4603,/doi/10.1007/s10472-006-9022-5,An algebraic framework for temporal attribute characteristics,https://doi.org/10.1007/s10472-006-9022-5
1266,4604,/doi/10.1145/3589334.3645568,Fast and Accurate Fair k-Center Clustering in Doubling Metrics,https://doi.org/10.1145/3589334.3645568
1267,4607,/doi/10.1007/978-3-031-46994-7_17,Solving k-Closest Pairs in High-Dimensional Data,https://doi.org/10.1007/978-3-031-46994-7_17
1268,4609,/doi/10.1007/978-3-030-60936-8_31,Running Experiments with Confidence and Sanity,https://doi.org/10.1007/978-3-030-60936-8_31
1269,4610,/doi/10.1145/3402448,A General Coreset-Based Approach to Diversity Maximization under Matroid Constraints,https://doi.org/10.1145/3402448
1270,4611,/doi/10.1007/978-3-030-32047-8_11,The Role of Local Intrinsic Dimensionality in Benchmarking Nearest Neighbor Search,https://doi.org/10.1007/978-3-030-32047-8_11
1271,4612,/doi/10.1007/978-3-030-24766-9_19,FRESH: Fréchet Similarity with Hashing,https://doi.org/10.1007/978-3-030-24766-9_19
1272,4615,/doi/10.14778/3317315.3317319,"Solving k-center clustering (with outliers) in MapReduce and streaming, almost as accurately as sequentially",https://doi.org/10.14778/3317315.3317319
1273,4616,/doi/10.1145/3159652.3159719,Fast Coreset-based Diversity Maximization under Matroid Constraints,https://doi.org/10.1145/3159652.3159719
1274,4617,/doi/10.14778/3055540.3055541,MapReduce and streaming algorithms for diversity maximization in metric spaces of bounded doubling dimension,https://doi.org/10.14778/3055540.3055541
1275,4619,/doi/10.1145/2755573.2755591,"Space and Time Efficient Parallel Graph Decomposition, Clustering, and Diameter Approximation",https://doi.org/10.1145/2755573.2755591
1276,4620,/doi/10.1145/2557833.2560572,Automated generation of model classes for Java PathFinder,https://doi.org/10.1145/2557833.2560572
1277,4622,/doi/10.1145/2382756.2382796,Tools to generate and check consistency of model classes for Java PathFinder,https://doi.org/10.1145/2382756.2382796
1278,4624,/doi/10.1007/978-3-031-39698-4_32,Distributed k-Means with Outliers in General Metrics,https://doi.org/10.1007/978-3-031-39698-4_32
1279,4626,/doi/10.1007/978-3-031-38906-1_41,Fully Dynamic Clustering and Diversity Maximization in Doubling Metrics,https://doi.org/10.1007/978-3-031-38906-1_41
1280,4628,/doi/10.1007/BF01840402,A new scheme for the deterministic simulation of PRAMs in VLSI,https://doi.org/10.1007/BF01840402
1281,4630,/doi/10.1145/2812804,Network-Oblivious Algorithms,https://doi.org/10.1145/2812804
1282,4633,/doi/10.1016/j.dam.2015.05.004,On the complexity of the shortest-path broadcast problem,https://doi.org/10.1016/j.dam.2015.05.004
1283,4639,/doi/10.1016/j.patrec.2015.07.023,Heterogeneous machine learning system for improving the diagnosis of primary aldosteronism,https://doi.org/10.1016/j.patrec.2015.07.023
1284,4645,/doi/10.1016/j.jpdc.2014.09.007,Space-efficient parallel algorithms for combinatorial search problems,https://doi.org/10.1016/j.jpdc.2014.09.007
1285,4647,/doi/10.1007/s00224-012-9390-7,On the Expansion and Diameter of Bluetooth-Like Topologies,https://doi.org/10.1007/s00224-012-9390-7
1286,4649,/doi/10.1145/2304576.2304607,Space-round tradeoffs for MapReduce computations,https://doi.org/10.1145/2304576.2304607
1287,4651,/doi/10.1145/2220357.2220359,An Efficient Rigorous Approach for Identifying Statistically Significant Frequent Itemsets,https://doi.org/10.1145/2220357.2220359
1288,4654,/doi/10.1145/1993806.1993882,Tight bounds on information dissemination in sparse mobile networks,https://doi.org/10.1145/1993806.1993882
1289,4655,/doi/10.1007/s10618-010-0185-7,Mining top-K frequent itemsets through progressive sampling,https://doi.org/10.1007/s10618-010-0185-7
1290,4656,/doi/10.1007/978-3-642-03869-3_90,Introduction,https://doi.org/10.1007/978-3-642-03869-3_90
1291,4660,/doi/10.1145/1559795.1559814,An efficient rigorous approach for identifying statistically significant frequent itemsets,https://doi.org/10.1145/1559795.1559814
1292,4661,/doi/10.1016/j.tcs.2008.08.001,Preface,https://doi.org/10.1016/j.tcs.2008.08.001
1293,4665,/doi/10.1145/3246979,Session details: Broadcasting in networks,https://doi.org/10.1145/3246979
1294,4666,/doi/10.1007/s00224-007-9008-7,Store-and-Forward Multicast Routing on the Mesh,https://doi.org/10.1007/s00224-007-9008-7
1295,4668,/doi/10.1109/CISIS.2007.41,Obtaining Performance Measures through Microbenchmarking in a Peer-to-Peer Overlay Computer,https://doi.org/10.1109/CISIS.2007.41
1296,4671,/doi/10.1016/j.jpdc.2005.06.008,Translating submachine locality into locality of reference,https://doi.org/10.1016/j.jpdc.2005.06.008
1297,4672,/doi/10.1007/11602569_41,The potential of on-chip multiprocessing for QCD machines,https://doi.org/10.1007/11602569_41
1298,4675,/doi/10.1007/11549468_101,Topic 12 theory and algorithms for parallel computation,https://doi.org/10.1007/11549468_101
1299,4678,/doi/10.1016/j.jpdc.2004.10.002,On stalling in LogP,https://doi.org/10.1016/j.jpdc.2004.10.002
1300,4679,/doi/10.1006/inco.2000.3004,Optimal deterministic protocols for mobile robots on a grid,https://doi.org/10.1006/inco.2000.3004
1301,4681,/doi/10.1016/S0304-3975%2800%2900386-8,Deterministic parallel backtrack search,https://doi.org/10.1016/S0304-3975(00)00386-8
1302,4682,/doi/10.1145/378580.378585,One-to-Many routing on the mesh,https://doi.org/10.1145/378580.378585
1303,4683,/doi/10.1006/inco.2000.3006,Implementing Shared Memory on Mesh-Connected Computers and on the Fat-Tree,https://doi.org/10.1006/inco.2000.3006
1304,4684,/doi/10.1137/S009753979732712X,"Constructive, Deterministic Implementation of Shared Memory on Meshes",https://doi.org/10.1137/S009753979732712X
1305,4686,/doi/10.1145/237502.237504,BSP vs LogP,https://doi.org/10.1145/237502.237504
1306,4688,/doi/10.1145/181014.181388,Constructive deterministic PRAM simulation on a mesh-connected computer,https://doi.org/10.1145/181014.181388
1307,4689,/doi/10.1145/165231.165245,A practical constructive scheme for deterministic shared-memory access,https://doi.org/10.1145/165231.165245
1308,4691,/doi/10.1016/0020-0190%2891%2990135-5,Analysis of parallel uniform hashing,https://doi.org/10.1016/0020-0190(91)90135-5
1309,4693,/doi/10.1145/3360553,Derivative grammars: a symbolic approach to parsing with derivatives,https://doi.org/10.1145/3360553
1310,4696,/doi/10.1007/978-3-030-32686-9_7,Bounds and Estimates on the Average Edit Distance,https://doi.org/10.1007/978-3-030-32686-9_7
1311,4698,/doi/10.1145/3181776,A Lower Bound Technique for Communication in BSP,https://doi.org/10.1145/3181776
1312,4699,/doi/10.1145/3075564.3075571,Optimal On-Line Computation of Stack Distances for MIN and OPT,https://doi.org/10.1145/3075564.3075571
1313,4702,/doi/10.1016/j.tcs.2013.01.016,Optimal eviction policies for stochastic address traces,https://doi.org/10.1016/j.tcs.2013.01.016
1314,4704,/doi/10.1007/978-3-642-32820-6_67,A lower bound technique for communication on BSP with application to the FFT,https://doi.org/10.1007/978-3-642-32820-6_67
1315,4705,/doi/10.1145/2016604.2016607,Efficient stack distance computation for priority replacement policies,https://doi.org/10.1145/2016604.2016607
1316,4706,/doi/10.1145/3251918,Session details: Keynote,https://doi.org/10.1145/3251918
1317,4707,/doi/10.1145/1552285.1552288,On approximating the ideal random access machine by physical machines,https://doi.org/10.1145/1552285.1552288
1318,4708,/doi/10.1016/j.tcs.2008.08.005,Area-time tradeoffs for universal VLSI circuits,https://doi.org/10.1016/j.tcs.2008.08.005
1319,4710,/doi/10.1145/3260578,Session details: Keynote II,https://doi.org/10.1145/3260578
1320,4711,/doi/10.1145/1242531.1242533,Models for parallel and hierarchical computation,https://doi.org/10.1145/1242531.1242533
1321,4712,/doi/10.1109/IWIAS.2006.38,The Speculative Prefetcher and Evaluator Processor for Pipelined Memory Hierarchies,https://doi.org/10.1109/IWIAS.2006.38
1322,4713,/doi/10.1109/IPDPS.2005.85,An Address Dependence Model of Computation for Hierarchical Memories with Pipelined Transfer,https://doi.org/10.1109/IPDPS.2005.85
1323,4714,/doi/10.1016/S0196-6774%2803%2900084-1,Preface,https://doi.org/10.1016/S0196-6774(03)00084-1
1324,4716,/doi/10.1145/765568.765573,Algorithms for computing the static single assignment form,https://doi.org/10.1145/765568.765573
1325,4717,/doi/10.1145/564870.564886,Optimal organizations for pipelined hierarchical memories,https://doi.org/10.1145/564870.564886
1326,4718,/doi/10.1145/378580.378615,Computational power of pipelined memory hierarchies,https://doi.org/10.1145/378580.378615
1327,4719,/doi/10.1006/jpdc.1998.1447,Tight Bounds on Parallel List Marking,https://doi.org/10.1006/jpdc.1998.1447
1328,4721,/doi/10.1007/s002240000066,"Processor--Time Tradeoffs under Bounded-Speed Message Propagation: Part I, Upper Bounds",https://doi.org/10.1007/s002240000066
1329,4722,/doi/10.1145/256167.256217,Optimal control dependence computation and the Roman chariots problem,https://doi.org/10.1145/256167.256217
1330,4723,/doi/10.1109/12.506427,On Bufferless Routing of Variable Length Messages in Leveled Networks,https://doi.org/10.1109/12.506427
1331,4726,/doi/10.1145/231379.231435,A framework for generalized control dependence,https://doi.org/10.1145/231379.231435
1332,4727,/doi/10.1145/215399.215443,Upper bounds to processor-time tradeoffs under bounded-speed message propagation,https://doi.org/10.1145/215399.215443
1333,4728,/doi/10.1145/207110.207114,APT: a data structure for optimal control dependence computation,https://doi.org/10.1145/207110.207114
1334,4729,/doi/10.1006/jpdc.1995.1080,Horizons of parallel computation,https://doi.org/10.1006/jpdc.1995.1080
1335,4730,/doi/10.1145/210346.210417,Deterministic on-line routing on area-universal networks,https://doi.org/10.1145/210346.210417
1336,4732,/doi/10.1016/0304-3975%2894%2900075-T,Language learning without overgeneralization,https://doi.org/10.1016/0304-3975(94)00075-T
1337,4734,/doi/10.1016/0020-0190%2894%2900070-0,A lower bound for area-universal graphs,https://doi.org/10.1016/0020-0190(94)00070-0
1338,4738,/doi/10.1137/S0097539789164765,Deterministic Simulations of Prams on Bounded Degree Networks,https://doi.org/10.1137/S0097539789164765
1339,4739,/doi/10.1016/0020-0190%2892%2990252-Q,On uniform learnability of language families,https://doi.org/10.1016/0020-0190(92)90252-Q
1340,4740,/doi/10.1145/130385.130419,Language learning from stochastic input,https://doi.org/10.1145/130385.130419
1341,4741,/doi/10.1145/121956.121961,Optimal VLSI architectures for multidimensional DFT (preliminary version),https://doi.org/10.1145/121956.121961
1342,4744,/doi/10.1109/FSCS.1990.89548,Deterministic on-line routing on area-universal networks,https://doi.org/10.1109/FSCS.1990.89548
1343,4745,/doi/10.1137/0219016,Characterization of associative operations with prefix circuits of constant depth and linear size,https://doi.org/10.1137/0219016
1344,4746,/doi/10.1145/62044.62052,Size-time complexity of Boolean networks for prefix computations,https://doi.org/10.1145/62044.62052
1345,4747,/doi/10.1137/0218014,Adaptive bitonic sorting: an optimal parallel algorithm for shared-memory machines,https://doi.org/10.1137/0218014
1346,4749,/doi/10.1145/72935.72963,Optimal VLSI architectures for multidimensional DFT,https://doi.org/10.1145/72935.72963
1347,4750,/doi/10.1145/28395.28442,Size-time complexity of Boolean networks for prefix computations,https://doi.org/10.1145/28395.28442
1348,4751,/doi/10.1007/BF01840437,Area-time lower-bound techniques with applications to sorting,https://doi.org/10.1007/BF01840437
1349,4752,/doi/10.1109/TIT.1985.1057117,Mean value of the output of a discrete-time volterra system driven by a Markov chain,https://doi.org/10.1109/TIT.1985.1057117
1350,4755,/doi/10.1109/TC.1985.5009384,A minimum area VLSI network for O(log n) time sorting,https://doi.org/10.1109/TC.1985.5009384
1351,4756,/doi/10.1016/0020-0190%2885%2990062-6,The VLSI optimality of the AKS sorting network,https://doi.org/10.1016/0020-0190(85)90062-6
1352,4757,/doi/10.1145/800057.808666,A minimum area VLSI network for O(logn) time sorting,https://doi.org/10.1145/800057.808666
1353,4758,/doi/10.1109/TC.1984.5009338,An Architecture for Bitonic Sorting with Optimal VLSI Performnance,https://doi.org/10.1109/TC.1984.5009338
1354,4759,/doi/10.1007/s00366-020-01253-y,Parallel graph-grammar-based algorithm for the longest-edge refinement of triangular meshes and the pollution simulations in Lesser Poland area,https://doi.org/10.1007/s00366-020-01253-y
1355,4765,/doi/10.1007/978-3-030-50371-0_8,A Massively Parallel Algorithm for the Three-Dimensional Navier-Stokes-Boussinesq Simulations of the Atmospheric Phenomena,https://doi.org/10.1007/978-3-030-50371-0_8
1356,4768,/doi/10.1007/978-3-319-93701-4_12,An Algorithm for Tensor Product Approximation of Three-Dimensional Material Data for Implicit Dynamics Simulations,https://doi.org/10.1007/978-3-319-93701-4_12
1357,4771,/doi/10.1016/j.cam.2022.114308,Tuning three-dimensional tumor progression simulations on a cluster of GPGPUs,https://doi.org/10.1016/j.cam.2022.114308
1358,4774,/doi/10.1016/j.camwa.2022.03.025,"Supermodeling, a convergent data assimilation meta-procedure used in simulation of tumor progression",https://doi.org/10.1016/j.camwa.2022.03.025
1359,4775,/doi/10.1016/j.compbiomed.2021.104797,Supermodeling in predictive diagnostics of cancer under treatment,https://doi.org/10.1016/j.compbiomed.2021.104797
