,ner_id,link,title,doi
0,1,/doi/10.1145/3010089.3010090,Defining Big Data,https://doi.org/10.1145/3010089.3010090
1,4,/doi/10.1145/3291801.3291822,Big Data with Ten Big Characteristics,https://doi.org/10.1145/3291801.3291822
2,8,/doi/10.1145/2513591.2527071,Big data: a research agenda,https://doi.org/10.1145/2513591.2527071
3,12,/doi/10.1145/3158352,Big data: big data or big brother? that is the question now.,https://doi.org/10.1145/3158352
4,17,/doi/10.1145/2611040.2611042,Big Data: from Hype to Reality?,https://doi.org/10.1145/2611040.2611042
5,19,/doi/10.1145/3010089.3010143,Healthcare Big Data: Challenges and Opportunities,https://doi.org/10.1145/3010089.3010143
6,21,/doi/10.1145/2640087.2644175,Big Data and Smart Grid,https://doi.org/10.1145/2640087.2644175
7,23,/doi/10.1145/3090354.3090401,From Data to Big Data: Moroccan Public Sector,https://doi.org/10.1145/3090354.3090401
8,27,/doi/10.1145/3647722.3647725,Big Data 4.0 = Meta4 (Big Data) = The Era of Big Intelligence,https://doi.org/10.1145/3647722.3647725
9,29,/doi/10.1145/2351316.2351318,"Big data, big business: bridging the gap",https://doi.org/10.1145/2351316.2351318
10,34,/doi/10.1145/3361758.3361768,"Big Data Infrastructure, Data Visualisation and Challenges",https://doi.org/10.1145/3361758.3361768
11,37,/doi/10.1145/2837060.2837068,Clarifying Big Data: The Concept and Its Applications,https://doi.org/10.1145/2837060.2837068
12,42,/doi/10.1145/2658840.2658845,Taming Big Data: Integrating diverse public data sources for economic competitiveness analytics,https://doi.org/10.1145/2658840.2658845
13,55,/doi/10.1145/3195528.3195533,Big data: deep learning for detecting malware,https://doi.org/10.1145/3195528.3195533
14,58,/doi/10.1145/2524248.2524253,"Big data, big questions",https://doi.org/10.1145/2524248.2524253
15,60,/doi/10.1145/3141128.3141139,Big Data and New Data Warehousing Approaches,https://doi.org/10.1145/3141128.3141139
16,63,/doi/10.1145/3010089.3017606,Integrating Big data paradigm in WSNs,https://doi.org/10.1145/3010089.3017606
17,67,/doi/10.1145/3216122.3216154,Efficient Big Data Clustering,https://doi.org/10.1145/3216122.3216154
18,72,/doi/10.1145/3210284.3214344,"Mosaics in Big Data: Stratosphere, Apache Flink, and Beyond",https://doi.org/10.1145/3210284.3214344
19,74,/doi/10.1145/3090354.3090376,Big Data Technologies to Improve Medical Data Warehousing,https://doi.org/10.1145/3090354.3090376
20,79,/doi/10.1145/3010089.3010127,Big Data Clustering using Data Streams Approach,https://doi.org/10.1145/3010089.3010127
21,83,/doi/10.1145/3011286.3011307,Environmental Big Data: a systematic mapping study,https://doi.org/10.1145/3011286.3011307
22,87,/doi/10.1145/2609876.2609890,Modeling in Big Data Environments,https://doi.org/10.1145/2609876.2609890
23,92,/doi/10.1145/2609876.2609889,Sensemaking in Big Data Environments,https://doi.org/10.1145/2609876.2609889
24,99,/doi/10.1145/2656346.2656358,Big data architecture evolution: 2014 and beyond,https://doi.org/10.1145/2656346.2656358
25,103,/doi/10.1145/3172871.3172886,State-of-the-art Big Data Security Taxonomies,https://doi.org/10.1145/3172871.3172886
26,106,/doi/10.1145/2609876.2609887,Support for Big Data's Limiting Resource: Human Attention,https://doi.org/10.1145/2609876.2609887
27,109,/doi/10.1109/CCGRID.2018.00100,Pedigree-ing your big data: data-driven big data privacy in distributed environments,https://doi.org/10.1109/CCGRID.2018.00100
28,111,/doi/10.1145/3018896.3025151,Where big data meets 5G?,https://doi.org/10.1145/3018896.3025151
29,114,/doi/10.1145/2837060.2837076,Big Data Mining Applications and Services,https://doi.org/10.1145/2837060.2837076
30,116,/doi/10.1145/3378904.3378907,Security Challenges for Big Data and IoT,https://doi.org/10.1145/3378904.3378907
31,121,/doi/10.1145/3289100.3289108,Towards Efficient Big Data: Hadoop Data Placing and Processing,https://doi.org/10.1145/3289100.3289108
32,126,/doi/10.1145/3341161.3343512,Flexible compression of big data,https://doi.org/10.1145/3341161.3343512
33,129,/doi/10.1145/3505745.3505750,Responsible Big Data Analytics for E-Business Services,https://doi.org/10.1145/3505745.3505750
34,131,/doi/10.1145/3603706,BIGQA: Declarative Big Data Quality Assessment,https://doi.org/10.1145/3603706
35,139,/doi/10.1145/3158335,"Big Data, Digitization, and Social Change: Big Data (Ubiquity symposium)",https://doi.org/10.1145/3158335
36,141,/doi/10.1145/3331651.3331659,Co-Designing Learning Materials to Empower Laypersons to Better Understand Big Data and Big Data Methods,https://doi.org/10.1145/3331651.3331659
37,148,/doi/10.1145/3158339,Big Data for Social Science Research: Big Data (Ubiquity symposium),https://doi.org/10.1145/3158339
38,150,/doi/10.1145/3341620.3341629,Big Data Quality Metrics for Sentiment Analysis Approaches,https://doi.org/10.1145/3341620.3341629
39,154,/doi/10.1145/3564665.3564673,Driving Digital Services with Big Data Analytics,https://doi.org/10.1145/3564665.3564673
40,156,/doi/10.1145/2659651.2659655,Big Data Information Security Maintenance,https://doi.org/10.1145/2659651.2659655
41,161,/doi/10.1145/3447879.3447883,Approximate computation for big data analytics,https://doi.org/10.1145/3447879.3447883
42,164,/doi/10.1145/2614512.2629588,Big data,https://doi.org/10.1145/2614512.2629588
43,166,/doi/10.1145/3158337,Big Data and the Attention Economy: Big Data (Ubiquity symposium),https://doi.org/10.1145/3158337
44,168,/doi/10.1145/3502300.3502312,US Army Big Data Military Applications and Reflections,https://doi.org/10.1145/3502300.3502312
45,171,/doi/10.1145/3366650.3366667,Online Updating Algorithms of Statistical Methods for Big Data,https://doi.org/10.1145/3366650.3366667
46,174,/doi/10.1145/2928294.2928297,Semantic big data for tax assessment,https://doi.org/10.1145/2928294.2928297
47,179,/doi/10.1145/3436286.3436291,Hot Topics of Big Data Research in China,https://doi.org/10.1145/3436286.3436291
48,181,/doi/10.1145/2905055.2905215,A Major Threat to Big Data: Data Security,https://doi.org/10.1145/2905055.2905215
49,184,/doi/10.1145/2837060.2837116,Big Data Processing Flow,https://doi.org/10.1145/2837060.2837116
50,186,/doi/10.1145/2837060.2837067,Big Data and Internet of Things: An Asset for Urban Planning,https://doi.org/10.1145/2837060.2837067
51,190,/doi/10.1145/3335484.3335534,Green Optical Networking for Big Data Transfer,https://doi.org/10.1145/3335484.3335534
52,192,/doi/10.1145/3368691.3368741,Big data analytics tools and applications: survey,https://doi.org/10.1145/3368691.3368741
53,197,/doi/10.1145/3372938.3372939,On the Intersection of Big Data and Privacy,https://doi.org/10.1145/3372938.3372939
54,200,/doi/10.1145/2896825.2896837,Toward big data value engineering for innovation,https://doi.org/10.1145/2896825.2896837
55,205,/doi/10.1145/3404687.3404694,A Comprehensive Overview of BIG DATA Technologies: A Survey,https://doi.org/10.1145/3404687.3404694
56,208,/doi/10.1145/2905055.2905099,Big data and ICT applications: A study,https://doi.org/10.1145/2905055.2905099
57,212,/doi/10.1145/3373419.3373425,Design Big Data Analysis System - Bigdeepexaminator,https://doi.org/10.1145/3373419.3373425
58,215,/doi/10.1145/3505745.3505751,A Strategic Perspective on Big Data Driven Socioeconomic Development,https://doi.org/10.1145/3505745.3505751
59,216,/doi/10.1145/3158348,Corporate Security is a Big Data Problem: Big Data (Ubiquity symposium),https://doi.org/10.1145/3158348
60,218,/doi/10.1145/3328833.3328841,Big Data in Healthcare: Are we getting useful insights from this avalanche of data?,https://doi.org/10.1145/3328833.3328841
61,224,/doi/10.1145/3626252.3630888,Learning Big Data Systems via Emulation,https://doi.org/10.1145/3626252.3630888
62,226,/doi/10.1145/3102254.3102271,Big-data-driven innovation for enterprises: innovative big value paradigms for next-generation digital ecosystems,https://doi.org/10.1145/3102254.3102271
63,229,/doi/10.1145/3524383.3533249,Accurately Identify Poor Students under Big Data,https://doi.org/10.1145/3524383.3533249
64,233,/doi/10.1145/2905055.2905194,Non-Relational Databases in Big Data,https://doi.org/10.1145/2905055.2905194
65,235,/doi/10.1145/3158350,"Big Data: Business, Technology, Education, and Science: Big Data (Ubiquity symposium)",https://doi.org/10.1145/3158350
66,244,/doi/10.1145/3363459.3363533,Big Data: A Decade of Energy Characteristics of Single-Family Homes in Florida,https://doi.org/10.1145/3363459.3363533
67,247,/doi/10.1145/2874239.2874256,Era of big data: danger of descrimination,https://doi.org/10.1145/2874239.2874256
68,250,/doi/10.1145/3474944.3474950,Anomaly Detection for Big Data Security: A Benchmark,https://doi.org/10.1145/3474944.3474950
69,256,/doi/10.1145/2534921.2534924,When big data meets big smog: a big spatio-temporal data framework for China severe smog analysis,https://doi.org/10.1145/2534921.2534924
70,263,/doi/10.1145/3627915.3629592,Design and Development of Big Data Platform for Smart University,https://doi.org/10.1145/3627915.3629592
71,268,/doi/10.1145/3409801,Big Data Processing on Volunteer Computing,https://doi.org/10.1145/3409801
72,272,/doi/10.1145/3209281.3209372,Census big data analytics use: international cross case analysis,https://doi.org/10.1145/3209281.3209372
73,277,/doi/10.1145/2948992.2949024,Data Warehousing in Big Data: From Multidimensional to Tabular Data Models,https://doi.org/10.1145/2948992.2949024
74,280,/doi/10.1145/3150919.3150923,Geospatial Big Data Analytics Engine for Spark,https://doi.org/10.1145/3150919.3150923
75,287,/doi/10.1145/3410352.3410785,Application of Big Data in Logistics,https://doi.org/10.1145/3410352.3410785
76,291,/doi/10.1145/3386723.3387841,Big Data security and privacy techniques,https://doi.org/10.1145/3386723.3387841
77,295,/doi/10.1145/2640087.2644153,"Computing Issues for Big Data: Theory, Systems and Applications",https://doi.org/10.1145/2640087.2644153
78,297,/doi/10.1145/2781562.2781574,Big Data Applications: Adaptive User Interfaces to Enhance Managerial Decision Making,https://doi.org/10.1145/2781562.2781574
79,299,/doi/10.1145/3010089.3010113,The Role of Sampling in Big Data Analysis,https://doi.org/10.1145/3010089.3010113
80,301,/doi/10.1145/2723372.2742794,Telco Churn Prediction with Big Data,https://doi.org/10.1145/2723372.2742794
81,311,/doi/10.1145/3132498.3132510,Characterizing big data software architectures: a systematic mapping study,https://doi.org/10.1145/3132498.3132510
82,315,/doi/10.1145/2609876.2609891,User Evaluation Methodology Framework in Big Data Environments,https://doi.org/10.1145/2609876.2609891
83,316,/doi/10.1145/2808580.2808667,Introducing big data topics: a multicourse experience report from Norway,https://doi.org/10.1145/2808580.2808667
84,321,/doi/10.1145/2663715.2669614,Privacy and Security of Big Data: Current Challenges and Future Research Perspectives,https://doi.org/10.1145/2663715.2669614
85,322,/doi/10.1145/3312714.3312728,IoT Big Data Value Map: How to Generate Value from IoT Data,https://doi.org/10.1145/3312714.3312728
86,326,/doi/10.1145/3383972.3384075,Sociological Aspects of Big Data Privacy,https://doi.org/10.1145/3383972.3384075
87,330,/doi/10.1145/3193077.3193079,Interaction Between Big Data and Cognitive Science,https://doi.org/10.1145/3193077.3193079
88,333,/doi/10.14778/2824032.2824140,Big data research: will industry solve all the problems?,https://doi.org/10.14778/2824032.2824140
89,335,/doi/10.1145/3264560.3264571,Definition and Scope of Big Data Problem,https://doi.org/10.1145/3264560.3264571
90,338,/doi/10.1145/2479724.2479730,"Big data and e-government: issues, policies, and recommendations",https://doi.org/10.1145/2479724.2479730
91,341,/doi/10.1145/2640087.2644168,Big Data Analysis with Interactive Visualization using R packages,https://doi.org/10.1145/2640087.2644168
92,348,/doi/10.1145/3297730.3297744,The Wisdom City Based on the Big Data Technology,https://doi.org/10.1145/3297730.3297744
93,351,/doi/10.1145/3501409.3501703,Construction and Innovative Application of Chongqing Ecological Environment Big Data Platform,https://doi.org/10.1145/3501409.3501703
94,359,/doi/10.1145/2939672.2939736,Crime Rate Inference with Big Data,https://doi.org/10.1145/2939672.2939736
95,364,/doi/10.1145/2481244.2481246,"Mining big data: current status, and forecast to the future",https://doi.org/10.1145/2481244.2481246
96,367,/doi/10.1145/2745754.2745771,Querying Big Data by Accessing Small Data,https://doi.org/10.1145/2745754.2745771
97,373,/doi/10.1145/3206157.3206166,"The 10 Vs, Issues and Challenges of Big Data",https://doi.org/10.1145/3206157.3206166
98,380,/doi/10.1145/2640087.2644173,Fast Mode Regression in Big Data Analysis,https://doi.org/10.1145/2640087.2644173
99,385,/doi/10.1145/2896387.2900335,"Warehousing and Protecting Big Data: State-Of-The-Art-Analysis, Methodologies, Future Challenges",https://doi.org/10.1145/2896387.2900335
100,386,/doi/10.1145/3538950.3538951,A Drug Safety Traceability Model Based on Big Data,https://doi.org/10.1145/3538950.3538951
101,392,/doi/10.1145/3510003.3510619,Big data = big insights?: operationalising brooks' law in a massive GitHub data set,https://doi.org/10.1145/3510003.3510619
102,397,/doi/10.1145/3416921.3416943,"Uncertainty and Imprecision in Big Data Management: Models, Issues, Paradigms, and Future Research Directions",https://doi.org/10.1145/3416921.3416943
103,398,/doi/10.1145/3183713.3183757,Big Data Linkage for Product Specification Pages,https://doi.org/10.1145/3183713.3183757
104,404,/doi/10.1145/3340017.3340032,Big Data Perception & Usage: A Micro-Firm Perspective (The Case of the French Traditional Restaurant Sector),https://doi.org/10.1145/3340017.3340032
105,407,/doi/10.1145/3424978.3425010,Research on Scientific Data Management in Big Data Era,https://doi.org/10.1145/3424978.3425010
106,411,/doi/10.1145/2612733.2612762,Local big data: the role of libraries in building community data infrastructures,https://doi.org/10.1145/2612733.2612762
107,414,/doi/10.1145/2812428.2812441,Big data in electricity-visualization aspect,https://doi.org/10.1145/2812428.2812441
108,417,/doi/10.1145/2447481.2447491,Predictive analytics with surveillance big data,https://doi.org/10.1145/2447481.2447491
109,423,/doi/10.1145/3291801.3291813,Intellectual Property Risks and Protection Mechanisms of Big Data,https://doi.org/10.1145/3291801.3291813
110,426,/doi/10.1145/2609876.2609884,Multidisciplinary Teamwork and Big Data,https://doi.org/10.1145/2609876.2609884
111,427,/doi/10.1145/2377978.2377984,Application-driven energy-efficient architecture explorations for big data,https://doi.org/10.1145/2377978.2377984
112,433,/doi/10.1145/3345252.3345282,Conceptual Architecture of GATE Big Data Platform,https://doi.org/10.1145/3345252.3345282
113,438,/doi/10.1145/2487575.2487588,Beyond myopic inference in big data pipelines,https://doi.org/10.1145/2487575.2487588
114,443,/doi/10.1145/2896825.2896828,A big data framework for cloud monitoring,https://doi.org/10.1145/2896825.2896828
115,449,/doi/10.1145/2609876.2609877,"Big Data and the Invisible, Social Dimensions of Science",https://doi.org/10.1145/2609876.2609877
116,451,/doi/10.1145/3579654.3579686,A method for accelerating relations search over big data scenario,https://doi.org/10.1145/3579654.3579686
117,456,/doi/10.1145/3148055.3148057,Big Data Aware Virtual Machine Placement in Cloud Data Centers,https://doi.org/10.1145/3148055.3148057
118,461,/doi/10.1145/3175684.3175687,A Data-based Method for Industrial Big Data Project Prioritization,https://doi.org/10.1145/3175684.3175687
119,466,/doi/10.1145/2345316.2345347,"On clusterization of ""big data"" streams",https://doi.org/10.1145/2345316.2345347
120,469,/doi/10.1145/3141128.3141149,"Scalable OLAP-Based Big Data Analytics over Cloud Infrastructures: Models, Issues, Algorithms",https://doi.org/10.1145/3141128.3141149
121,470,/doi/10.1145/3368691.3368717,Big data challenges and achievements: applications on smart cities and energy sector,https://doi.org/10.1145/3368691.3368717
122,475,/doi/10.1145/3474944.3474962,Research on University Education Innovation in the Big Data Era,https://doi.org/10.1145/3474944.3474962
123,477,/doi/10.1145/3627377.3627394,Innovation in the maths classroom with big data for education,https://doi.org/10.1145/3627377.3627394
124,480,/doi/10.1145/3579371.3589082,Profiling Hyperscale Big Data Processing,https://doi.org/10.1145/3579371.3589082
125,490,/doi/10.1145/2331042.2331058,Interactive analysis of big data,https://doi.org/10.1145/2331042.2331058
126,493,/doi/10.1145/3379247.3379294,Malicious SIM Cards Identification Method Based on Telecom Big Data Analytics,https://doi.org/10.1145/3379247.3379294
127,501,/doi/10.1145/3085228.3085319,Can big data improve public policy analysis?,https://doi.org/10.1145/3085228.3085319
128,505,/doi/10.1145/3503928.3503929,Big Data: Finding Frequencies of Faulty Multimedia Data,https://doi.org/10.1145/3503928.3503929
129,509,/doi/10.1145/2660168.2660187,Big Data for Musicology,https://doi.org/10.1145/2660168.2660187
130,525,/doi/10.1145/3474944.3474951,Big Data Analytics in Association Rule Mining: A Systematic Literature Review,https://doi.org/10.1145/3474944.3474951
131,533,/doi/10.1145/3090354.3090370,Towards Clustering Validation in Big Data Context,https://doi.org/10.1145/3090354.3090370
132,538,/doi/10.1145/3404687.3404707,Optimization of Clothing Supply Standard Based on Big Data,https://doi.org/10.1145/3404687.3404707
133,542,/doi/10.1145/2890602.2890619,Big Data and Analytics Leaders: the Changing Role of CIO,https://doi.org/10.1145/2890602.2890619
134,546,/doi/10.1145/3019612.3019700,From IoT big data to IoT big services,https://doi.org/10.1145/3019612.3019700
135,550,/doi/10.1145/2957276.2997027,Towards Re-Orienting the Big Data Rhetoric,https://doi.org/10.1145/2957276.2997027
136,552,/doi/10.1145/3564665.3564677,Research on Health Management System Based on Big Data Technology,https://doi.org/10.1145/3564665.3564677
137,554,/doi/10.1145/3444757.3485106,Locality-Aware Workflow Orchestration for Big Data,https://doi.org/10.1145/3444757.3485106
138,562,/doi/10.1145/3274250.3275113,Big Data Service Delivery Network,https://doi.org/10.1145/3274250.3275113
139,565,/doi/10.1145/3127942.3127961,Determinants of Big Data Adoption and Success,https://doi.org/10.1145/3127942.3127961
140,569,/doi/10.1145/2699414,Exascale computing and big data,https://doi.org/10.1145/2699414
141,572,/doi/10.1145/2676536.2676538,High performance integrated spatial big data analytics,https://doi.org/10.1145/2676536.2676538
142,577,/doi/10.1145/3220199.3220220,SAT-based Important Data Reliability Enhancement Model for Big Data Storage,https://doi.org/10.1145/3220199.3220220
143,581,/doi/10.1145/3481646.3481649,Benchmarking Apache Spark and Hadoop MapReduce on Big Data Classification,https://doi.org/10.1145/3481646.3481649
144,584,/doi/10.1145/3264560.3266429,Scalable Privacy-Preserving Big Data Management and Analytics: Where We Are and Where We Are Going,https://doi.org/10.1145/3264560.3266429
145,585,/doi/10.1145/2745754.2745782,"Computational Thinking, Inferential Thinking and ""Big Data""",https://doi.org/10.1145/2745754.2745782
146,587,/doi/10.1145/3323878.3325802,Parallel RDF generation from heterogeneous big data,https://doi.org/10.1145/3323878.3325802
147,593,/doi/10.1145/3578339.3578345,Research on Satellite-borne Big-data Storage System,https://doi.org/10.1145/3578339.3578345
148,599,/doi/10.1145/3438872.3439086,Design and Implementation of Componentized Big Data Platform,https://doi.org/10.1145/3438872.3439086
149,603,/doi/10.1145/2247596.2247598,"Inside ""Big Data management"": ogres, onions, or parfaits?",https://doi.org/10.1145/2247596.2247598
150,607,/doi/10.1145/2345316.2345328,Cloud computing & big data computing,https://doi.org/10.1145/2345316.2345328
151,609,/doi/10.1145/2538862.2538877,Integrating big data into the computing curricula,https://doi.org/10.1145/2538862.2538877
152,614,/doi/10.1145/3437075.3437078,"Implementation of Big Data Analytics: Customers Analyzing using an Association Rule Modeling in a Gold, Silver, and Precious Metal Trading Company in Indonesia",https://doi.org/10.1145/3437075.3437078
153,618,/doi/10.1145/3404555.3404630,Efficient Optimized Strategy of Big Data Retrieval,https://doi.org/10.1145/3404555.3404630
154,624,/doi/10.1145/2588555.2610512,Opportunistic physical design for big data analytics,https://doi.org/10.1145/2588555.2610512
155,630,/doi/10.1145/3507524.3507534,Enterprise big data management based on Knowledge Graph,https://doi.org/10.1145/3507524.3507534
156,634,/doi/10.1145/3322134.3322137,Implementation Practice of Big Data Technology in a Sharing Economy,https://doi.org/10.1145/3322134.3322137
157,636,/doi/10.1145/2839509.2844651,Teaching Big Data with a Virtual Cluster,https://doi.org/10.1145/2839509.2844651
158,638,/doi/10.1145/2837060.2837112,Safe-Return-Home Service based on Big Data Analytics,https://doi.org/10.1145/2837060.2837112
159,643,/doi/10.1145/3006299.3006311,Towards a comprehensive data lifecycle model for big data environments,https://doi.org/10.1145/3006299.3006311
160,648,/doi/10.1145/2479724.2479764,"The complexities of ""big data"": the opportunities and challenges for e-government",https://doi.org/10.1145/2479724.2479764
161,651,/doi/10.1145/3010089.3016031,A mixture model approach to big data clustering and classification,https://doi.org/10.1145/3010089.3016031
162,653,/doi/10.1145/2331042.2331057,Big data platforms: What's next?,https://doi.org/10.1145/2331042.2331057
163,654,/doi/10.1145/2379436.2379440,Workload diversity and dynamics in big data analytics: implications to system designers,https://doi.org/10.1145/2379436.2379440
164,658,/doi/10.1145/3419604.3419803,Towards a Data Quality Assessment in Big Data,https://doi.org/10.1145/3419604.3419803
165,663,/doi/10.1145/2693561.2693563,Runtime Performance Challenges in Big Data Systems,https://doi.org/10.1145/2693561.2693563
166,666,/doi/10.1145/3423603.3424056,Recent applications of big data in finance,https://doi.org/10.1145/3423603.3424056
167,671,/doi/10.1109/CCGrid.2016.107,Management of distributed big data for social networks,https://doi.org/10.1109/CCGrid.2016.107
168,673,/doi/10.1145/3456389.3456390,Opportunities and Challenges of Marketing in the Context of Big Data,https://doi.org/10.1145/3456389.3456390
169,675,/doi/10.1145/3090354.3090363,Big Data Analytics Techniques in Virtual Screening for Drug Discovery,https://doi.org/10.1145/3090354.3090363
170,678,/doi/10.1145/3264560.3264572,From Big Data to Better Behavior in Self-Driving Cars,https://doi.org/10.1145/3264560.3264572
171,682,/doi/10.1145/2911975,What happens when big data blunders?,https://doi.org/10.1145/2911975
172,684,/doi/10.1145/3239438.3239485,Disease Trajectory Visualization System Based on Big Data Analytics,https://doi.org/10.1145/3239438.3239485
173,689,/doi/10.1145/3141128.3141138,A Systematic Review of Big Data Analytics Using Model Driven Engineering,https://doi.org/10.1145/3141128.3141138
174,694,/doi/10.1145/2983323.2983345,City-Scale Localization with Telco Big Data,https://doi.org/10.1145/2983323.2983345
175,700,/doi/10.1145/2666310.2666481,Efficient spatial query processing for big data,https://doi.org/10.1145/2666310.2666481
176,705,/doi/10.1145/2612733.2612779,Building government's capacity for big data analysis,https://doi.org/10.1145/2612733.2612779
177,706,/doi/10.1145/3341042.3341056,Ethics Education of Information and Big Data,https://doi.org/10.1145/3341042.3341056
178,711,/doi/10.1145/3312614.3312623,"The 51 V's Of Big Data: Survey, Technologies, Characteristics, Opportunities, Issues and Challenges",https://doi.org/10.1145/3312614.3312623
179,718,/doi/10.1145/3006386.3006387,Analytics on public transport delays with spatial big data,https://doi.org/10.1145/3006386.3006387
180,722,/doi/10.1145/3239283.3239322,Study on big data framework for product design,https://doi.org/10.1145/3239283.3239322
181,725,/doi/10.1145/3242840.3242842,Load Forecasting Research Based on High Performance Intelligent Data Processing of Power Big Data,https://doi.org/10.1145/3242840.3242842
182,731,/doi/10.1145/3134302.3134335,Modelling of Educational Data Following Big Data Value Chain,https://doi.org/10.1145/3134302.3134335
183,733,/doi/10.1109/JCDL.2019.00118,"Organizing data, information, and knowledge in big data environments",https://doi.org/10.1109/JCDL.2019.00118
184,737,/doi/10.1145/3341620.3341639,Construction and Application of Data Standard in Big Data Environment,https://doi.org/10.1145/3341620.3341639
185,740,/doi/10.1145/3290420.3290466,Big data prototype practice for unmanned surface vehicle,https://doi.org/10.1145/3290420.3290466
186,744,/doi/10.1145/3106237.3117774,Static analysis for optimizing big data queries,https://doi.org/10.1145/3106237.3117774
187,751,/doi/10.1145/2463676.2463707,The big data ecosystem at LinkedIn,https://doi.org/10.1145/2463676.2463707
188,755,/doi/10.1145/3512731.3534211,Towards Intellectual Property Rights Protection in Big Data,https://doi.org/10.1145/3512731.3534211
189,760,/doi/10.1145/3129757.3129762,Official statistics embrace big data: a review of current and developing international practice,https://doi.org/10.1145/3129757.3129762
190,762,/doi/10.1145/2611567,Big data and its technical challenges,https://doi.org/10.1145/2611567
191,769,/doi/10.14778/2367502.2367563,MapReduce algorithms for big data analysis,https://doi.org/10.14778/2367502.2367563
192,771,/doi/10.1145/3063955.3063968,The design of course architecture for big data,https://doi.org/10.1145/3063955.3063968
193,776,/doi/10.1145/3437075.3437083,Data Privacy of Enterprises in the Era of Big data: Evidence from China,https://doi.org/10.1145/3437075.3437083
194,781,/doi/10.1145/3560107.3560310,ADACOP: A Big Data Platform for Open Government Data,https://doi.org/10.1145/3560107.3560310
