,ner_id,link,title,doi
375,1473,/doi/10.1145/3076113.3076115,Big data causing big (TLB) problems: taming random memory accesses on the GPU,https://doi.org/10.1145/3076113.3076115
376,1477,/doi/10.1145/2647908.2655958,Resource-optimizing adaptation for big data applications,https://doi.org/10.1145/2647908.2655958
377,1480,/doi/10.1145/3056662.3056667,"Performance and energy efficiency of big data systems: characterization, implication and improvement",https://doi.org/10.1145/3056662.3056667
378,1484,/doi/10.1145/3589860.3589880,The Impact of Big Data on Financial Reporting,https://doi.org/10.1145/3589860.3589880
379,1490,/doi/10.1145/3377571.3377600,"Research on Motivation and Regulation of Big Data ""Slaughter"" Behavior",https://doi.org/10.1145/3377571.3377600
380,1492,/doi/10.1145/3234664.3234677,Research on Clothing and Accouterment Security Based on Big Data,https://doi.org/10.1145/3234664.3234677
381,1495,/doi/10.1145/3151759.3151780,A new knowledge capitalization framework in big data context,https://doi.org/10.1145/3151759.3151780
382,1499,/doi/10.1145/2967938.2967957,Auto-tuning Spark Big Data Workloads on POWER8: Prediction-Based Dynamic SMT Threading,https://doi.org/10.1145/2967938.2967957
383,1506,/doi/10.1145/3014812.3014869,A big data analytic framework for investigating streaming educational data,https://doi.org/10.1145/3014812.3014869
384,1512,/doi/10.1145/2939502.2939518,Big data exploration requires collaboration between visualization and data infrastructures,https://doi.org/10.1145/2939502.2939518
385,1514,/doi/10.1145/3551708.3551726,Research on Employment Guidance for Graduates in Big Data Era,https://doi.org/10.1145/3551708.3551726
386,1516,/doi/10.1145/3089251.3089252,Evolutionary feature manipulation in data mining/big data,https://doi.org/10.1145/3089251.3089252
387,1519,/doi/10.1145/3297156.3297249,Methodology of Big Data Integration from A Priori Unknown Heterogeneous Data Sources,https://doi.org/10.1145/3297156.3297249
388,1524,/doi/10.1109/SEAMS.2017.20,Self-adaptation based on big data analytics: a model problem and tool,https://doi.org/10.1109/SEAMS.2017.20
389,1529,/doi/10.1145/3510858.3510975,Application Analysis of Hadoop in Big Data Processing,https://doi.org/10.1145/3510858.3510975
390,1531,/doi/10.1145/2851141.2851187,Preemption-aware planning on big-data systems,https://doi.org/10.1145/2851141.2851187
391,1537,/doi/10.1145/2611286.2611311,Mobile CEP in real-time big data processing: challenges and opportunities,https://doi.org/10.1145/2611286.2611311
392,1542,/doi/10.1145/2968456.2976765,Big data analytics on heterogeneous accelerator architectures,https://doi.org/10.1145/2968456.2976765
393,1545,/doi/10.1145/2675743.2771878,Reliable event messaging in big data enterprises: looking for the balance between producers and consumers,https://doi.org/10.1145/2675743.2771878
394,1547,/doi/10.1145/3453187.3453340,Research on Smart Education Service Platform Based on Big Data,https://doi.org/10.1145/3453187.3453340
395,1551,/doi/10.1145/3358528.3358584,Big Data Service Request Prediction Based on Historical Behavior Time Series,https://doi.org/10.1145/3358528.3358584
396,1558,/doi/10.1145/2487575.2487677,Big data analytics with small footprint: squaring the cloud,https://doi.org/10.1145/2487575.2487677
397,1561,/doi/10.1109/CCGrid.2015.174,Cloud-based OLAP over big data: application scenarios and performance analysis,https://doi.org/10.1109/CCGrid.2015.174
398,1565,/doi/10.14778/2733004.2733037,Redoop infrastructure for recurring big data queries,https://doi.org/10.14778/2733004.2733037
399,1569,/doi/10.1145/3617184.3618036,Data Visualization Analysis for Job Recruitment Based on Big Data,https://doi.org/10.1145/3617184.3618036
400,1573,/doi/10.1145/3524383.3524442,Research on the Application of Big Data in University's Public Opinion Monitoring and Processing,https://doi.org/10.1145/3524383.3524442
401,1577,/doi/10.1145/3416921.3416944,OLAPing Big Social Data: Multidimensional Big Data Analytics over Big Social Data Repositories,https://doi.org/10.1145/3416921.3416944
402,1578,/doi/10.1145/2783258.2788563,Big Data System for Analyzing Risky Procurement Entities,https://doi.org/10.1145/2783258.2788563
403,1584,/doi/10.1145/3402569.3409041,Research on Foreign Exchange Management Model Based on Big Data,https://doi.org/10.1145/3402569.3409041
404,1586,/doi/10.1145/3297663.3310302,Characterization of a Big Data Storage Workload in the Cloud,https://doi.org/10.1145/3297663.3310302
405,1591,/doi/10.1145/3433996.3434027,The Planning and Construction of Healthcare Big Data Platform,https://doi.org/10.1145/3433996.3434027
406,1598,/doi/10.1145/3377170.3377180,How Big Data Analytics Impacts Agility: The Moderation Effect of Orientation of Interactive Team Cognition,https://doi.org/10.1145/3377170.3377180
407,1600,/doi/10.1145/2448917.2448923,"Big data, situated people: humane approaches to communication design",https://doi.org/10.1145/2448917.2448923
408,1602,/doi/10.1145/3437075.3437086,Tackling Big Data and Black Swans through Fractal Approach and Quantum Technology,https://doi.org/10.1145/3437075.3437086
409,1606,/doi/10.1145/2912845.2912869,Development of a knowledge system for Big Data: Case study to plant phenotyping data,https://doi.org/10.1145/2912845.2912869
410,1612,/doi/10.1145/3293614.3293626,"A Computer Cluster for Big Data and Data Analytics Management: Design, Implementation, and Assessment",https://doi.org/10.1145/3293614.3293626
411,1618,/doi/10.1145/2642769.2642802,HPC in Big Data Age: An Evaluation Report for Java-Based Data-Intensive Applications Implemented with Hadoop and OpenMPI,https://doi.org/10.1145/2642769.2642802
412,1620,/doi/10.1145/2908216.2908222,Big data and social netbanks: what happens when tech companies become financial companies?,https://doi.org/10.1145/2908216.2908222
413,1623,/doi/10.1145/3372454.3372462,Improvement of Big Data Stream Mining Technique for Automatic Bone Age Assessment,https://doi.org/10.1145/3372454.3372462
414,1628,/doi/10.1145/3564665.3564676,Research on Design Model of Data Asset Operation Monitoring Platform Based on Power Big Data,https://doi.org/10.1145/3564665.3564676
415,1633,/doi/10.1145/3368756.3369096,Big data analysis from the smart-logistics for smart-cities,https://doi.org/10.1145/3368756.3369096
416,1637,/doi/10.1145/3444757.3485107,Dynamic and Scalable Enforcement of Access Control Policies for Big Data,https://doi.org/10.1145/3444757.3485107
417,1643,/doi/10.1145/3582935.3583052,Design of Geospatial Big Data Cloud Platform for Land Resources,https://doi.org/10.1145/3582935.3583052
418,1648,/doi/10.1145/3206157.3206173,Research on College Students' Psychological Crisis Intervention in the Context of Big Data,https://doi.org/10.1145/3206157.3206173
419,1650,/doi/10.1145/3448748.3448749,The application and influence of big data in medicine,https://doi.org/10.1145/3448748.3448749
420,1652,/doi/10.1145/2524224.2524227,Using big data for more dependability: a cellular network tale,https://doi.org/10.1145/2524224.2524227
421,1657,/doi/10.1145/3448734.3450843,A Network Load Balancing Algorithm Design Based on Big Data,https://doi.org/10.1145/3448734.3450843
422,1660,/doi/10.1145/3656766.3656871,Hardware and Software Infrastructure Driven by Big Data: Challenges and Prospects,https://doi.org/10.1145/3656766.3656871
423,1662,/doi/10.1145/3371158.3371161,Concealed Multidimensional Data Aggregation in Big Data Wireless Sensor Networks,https://doi.org/10.1145/3371158.3371161
424,1665,/doi/10.1145/2642937.2643006,Program analysis for secure big data processing,https://doi.org/10.1145/2642937.2643006
425,1670,/doi/10.1145/3318464.3389770,Qd-tree: Learning Data Layouts for Big Data Analytics,https://doi.org/10.1145/3318464.3389770
426,1679,/doi/10.1145/3573428.3573647,Construction of financial big data framework based on management accounting,https://doi.org/10.1145/3573428.3573647
427,1681,/doi/10.1145/2640087.2644162,The Value of Using Big Data Technologies in Computational Social Science,https://doi.org/10.1145/2640087.2644162
428,1683,/doi/10.1145/3481646.3481647,"SeDaSOMA: A Framework for Supporting Serendipitous, Data-As-A-Service-Oriented, Open Big Data Management and Analytics",https://doi.org/10.1145/3481646.3481647
429,1687,/doi/10.1145/3341161.3343518,Multivariate motif detection in local weather big data,https://doi.org/10.1145/3341161.3343518
430,1691,/doi/10.1145/3368756.3369080,Towards an efficient vehicle traffic management using big data,https://doi.org/10.1145/3368756.3369080
431,1692,/doi/10.1145/2659532.2659593,"Big data, high-performance computing, and MapReduce",https://doi.org/10.1145/2659532.2659593
432,1694,/doi/10.1145/3230348.3230425,Application Research of Big Data E-commerce in Closed Community,https://doi.org/10.1145/3230348.3230425
433,1699,/doi/10.1109/CCGrid.2016.85,Towards memory-optimized data shuffling patterns for big data analytics,https://doi.org/10.1109/CCGrid.2016.85
434,1705,/doi/10.1145/3404687.3404705,Understanding Consumer Behavior by Big Data Visualization in the Smart Space Laboratory,https://doi.org/10.1145/3404687.3404705
435,1709,/doi/10.1145/3236461.3241967,Identifying Critical Issues in Smart City Big Data Project Implementation,https://doi.org/10.1145/3236461.3241967
436,1712,/doi/10.1145/3582197.3582207,Big data tax collection and management and bank credit financing,https://doi.org/10.1145/3582197.3582207
437,1714,/doi/10.1145/3637494.3637497,Research on Smart Education Platform Based on Big Data Technology,https://doi.org/10.1145/3637494.3637497
438,1720,/doi/10.1145/3206157.3206181,Optimized Rank Estimator in Big Data Social Networks,https://doi.org/10.1145/3206157.3206181
439,1722,/doi/10.1145/2818302.2818308,Speculative region-based memory management for big data systems,https://doi.org/10.1145/2818302.2818308
440,1726,/doi/10.1109/CCGRID.2018.00052,Service-oriented architecture for big data analytics in smart cities,https://doi.org/10.1109/CCGRID.2018.00052
441,1729,/doi/10.1145/3170521.3170535,Imbalanced big data classification: a distributed implementation of SMOTE,https://doi.org/10.1145/3170521.3170535
442,1733,/doi/10.1145/3594441.3594457,Research and Practice of Emerging Engineering Big Data Talents Cultivation,https://doi.org/10.1145/3594441.3594457
443,1738,/doi/10.1145/3573926.3573932,A Systemic Big Data Framework for the Charging Pile Business,https://doi.org/10.1145/3573926.3573932
444,1741,/doi/10.1145/3090354.3090386,Toward Efficient Ranked-key Algorithm for the Web notification of Big Data Systems,https://doi.org/10.1145/3090354.3090386
445,1744,/doi/10.1145/3396452.3396462,Big Data in Ideological and Political Education in Colleges and Universities Application and Reflection,https://doi.org/10.1145/3396452.3396462
446,1746,/doi/10.1145/2818869.2818904,Rethinking the Destination Marketing Organization Management in the Big Data Era,https://doi.org/10.1145/2818869.2818904
447,1749,/doi/10.1145/2451856.2451869,Telling the story in big data,https://doi.org/10.1145/2451856.2451869
448,1753,/doi/10.1145/3230833.3232816,New authentication concept using certificates for big data analytic tools,https://doi.org/10.1145/3230833.3232816
449,1757,/doi/10.1145/3134271.3134300,Research on Evolution and Visualization Analysis of Application of Big Data,https://doi.org/10.1145/3134271.3134300
450,1760,/doi/10.1145/3507473.3507479,3D Structural Characteristics Used Big Data of Shulu Slope Zone,https://doi.org/10.1145/3507473.3507479
451,1767,/doi/10.1145/3075564.3078885,Sorting big data on heterogeneous near-data processing systems,https://doi.org/10.1145/3075564.3078885
452,1772,/doi/10.1145/3448748.3448787,Promotion of Marketing Efficiency of SMEs Based on Big Data,https://doi.org/10.1145/3448748.3448787
453,1775,/doi/10.1145/2642769.2642798,Architecture-Awareness for Real-Time Big Data Systems,https://doi.org/10.1145/2642769.2642798
454,1780,/doi/10.1145/3451400.3451416,Challenges and Opportunities of Using Big Data in the Management and Education of College Students,https://doi.org/10.1145/3451400.3451416
455,1785,/doi/10.1145/3240117.3240139,Les Archives à l'Ère des Big Data: Les Enjeux de l'Archivage des Données Numériques Massives,https://doi.org/10.1145/3240117.3240139
456,1788,/doi/10.1145/3293614.3293624,Building Software Products with use Open Data and Big Data in Smart Cities,https://doi.org/10.1145/3293614.3293624
457,1794,/doi/10.1145/2670386.2670388,Analysis of large call data records with big data,https://doi.org/10.1145/2670386.2670388
458,1799,/doi/10.1145/3494885.3494891,Exploring Support Vector Machines for Big Data Analyses,https://doi.org/10.1145/3494885.3494891
459,1806,/doi/10.1145/3358528.3358552,Iot-Enabled Supply Chain Finance Risk Management Performance Big Data Analysis Using Fuzzy Qfd,https://doi.org/10.1145/3358528.3358552
460,1807,/doi/10.14778/3368289.3368299,Incorporating super-operators in big-data query optimizers,https://doi.org/10.14778/3368289.3368299
461,1809,/doi/10.1145/3234825.3234843,Research of Wisdom and Lifelong Education Based on Big Data,https://doi.org/10.1145/3234825.3234843
462,1811,/doi/10.1145/3379247.3379282,Evaluation Method of Equipment Combat Effectiveness Based On Big Data Mining,https://doi.org/10.1145/3379247.3379282
463,1815,/doi/10.1145/2808797.2808841,Big Data and the Regulation of Financial Markets,https://doi.org/10.1145/2808797.2808841
464,1821,/doi/10.1145/3456887.3457522,Research on the Application Status of University Sports Big Data,https://doi.org/10.1145/3456887.3457522
465,1824,/doi/10.1145/2460625.2460642,From big data to insights: opportunities and challenges for TEI in genomics,https://doi.org/10.1145/2460625.2460642
466,1829,/doi/10.1145/3012286,"Big Data Meets Digital Cultural Heritage: Design and Implementation of SCRABS, A Smart Context-awaRe Browsing Assistant for Cultural EnvironmentS",https://doi.org/10.1145/3012286
467,1837,/doi/10.1145/2331042.2331060,Parallel machine learning on big data,https://doi.org/10.1145/2331042.2331060
468,1839,/doi/10.1145/3193063.3193069,An Overview of Techniques for Confirming Big Data Property Rights,https://doi.org/10.1145/3193063.3193069
469,1842,/doi/10.1145/3418688.3418697,The Effect of Big Data Platforms on Multi-Stage Production System in Industrie 4.0,https://doi.org/10.1145/3418688.3418697
470,1846,/doi/10.1145/3269206.3269232,From Copernicus Big Data to Big Information and Big Knowledge: A Demo from the Copernicus App Lab Project,https://doi.org/10.1145/3269206.3269232
471,1856,/doi/10.1145/3428363.3428369,Distributed Principal Component Analysis for Real-time Big Data Processing,https://doi.org/10.1145/3428363.3428369
472,1860,/doi/10.1145/3415958.3433077,Big-Data Driven Digital Ecosystem Framework for Online Predictive Control,https://doi.org/10.1145/3415958.3433077
473,1864,/doi/10.1145/2554688.2554789,Scalable multi-access flash store for big data analytics,https://doi.org/10.1145/2554688.2554789
474,1869,/doi/10.1145/3205977.3205998,Access Control in the Era of Big Data: State of the Art and Research Directions,https://doi.org/10.1145/3205977.3205998
475,1872,/doi/10.1145/3578339.3578347,Research on the Application of Energy Wisdom Based on Power Iot and Big Data,https://doi.org/10.1145/3578339.3578347
476,1878,/doi/10.1145/2676536.2676543,A MapReduce algorithm to create contiguity weights for spatial analysis of big data,https://doi.org/10.1145/2676536.2676543
477,1884,/doi/10.1145/3175603.3175613,Key Technologies of Big Data and Its Development in Intelligent Ship,https://doi.org/10.1145/3175603.3175613
478,1887,/doi/10.1145/3564665.3564678,Application of Big Data Technology in Tax Collection and Management and Tax Business Environment,https://doi.org/10.1145/3564665.3564678
479,1890,/doi/10.1145/2588555.2610498,Indexing for interactive exploration of big data series,https://doi.org/10.1145/2588555.2610498
480,1894,/doi/10.1145/3339186.3339207,QoS-Aware Proactive Data Replication for Big Data Analytics in Edge Clouds,https://doi.org/10.1145/3339186.3339207
481,1901,/doi/10.1145/3465375,PoBery: Possibly-complete Big Data Queries with Probabilistic Data Placement and Scanning,https://doi.org/10.1145/3465375
482,1907,/doi/10.1145/3129292.3129296,Towards Real-Time Road Traffic Analytics using Telco Big Data,https://doi.org/10.1145/3129292.3129296
483,1912,/doi/10.1145/3331453.3362052,Analysis of Behavioral Characteristics Based on Student's Personal Big Data,https://doi.org/10.1145/3331453.3362052
484,1918,/doi/10.1145/3219104.3229288,Building Big Data Processing and Visualization Pipeline through Apache Zeppelin,https://doi.org/10.1145/3219104.3229288
485,1924,/doi/10.1145/2743065.2743121,"Big Data Scalability, Methods and its Implications: A Survey of Current Practice",https://doi.org/10.1145/2743065.2743121
486,1929,/doi/10.1145/3474944.3474954,The Regulatory Path of Big-Data Price Discrimination-Based on Economic Characteristics and Legal Accountability,https://doi.org/10.1145/3474944.3474954
487,1931,/doi/10.1145/2463676.2465290,Fast data in the era of big data: Twitter's real-time related query suggestion architecture,https://doi.org/10.1145/2463676.2465290
488,1936,/doi/10.1145/3408127.3408180,Research on Big Data Parallel Processing Platform Based on Postal Industry,https://doi.org/10.1145/3408127.3408180
489,1939,/doi/10.1145/3656766.3656945,Study on Big Data Applications in Civil Aviation Airport Management and Services,https://doi.org/10.1145/3656766.3656945
490,1941,/doi/10.1145/3625156.3625166,A Visual Programming Environment for Describing Complex Big Data Functions,https://doi.org/10.1145/3625156.3625166
491,1943,/doi/10.1145/3656766.3656901,Research on the Agricultural Risk Management in the Era of Big Data,https://doi.org/10.1145/3656766.3656901
492,1945,/doi/10.1145/3321454.3321474,Research on the Construction of Big Data Trading Platform in China,https://doi.org/10.1145/3321454.3321474
493,1947,/doi/10.1145/2342441.2342462,Programming your network at run-time for big data applications,https://doi.org/10.1145/2342441.2342462
494,1951,/doi/10.1109/CCGrid.2016.61,On efficient hierarchical storage for big data processing,https://doi.org/10.1109/CCGrid.2016.61
495,1957,/doi/10.1145/2660168.2660177,Prospects for a Big Data History of Music,https://doi.org/10.1145/2660168.2660177
496,1960,/doi/10.1145/3481056.3481108,Application and Development of Educational Big Data in University Course Learning,https://doi.org/10.1145/3481056.3481108
497,1963,/doi/10.1145/3147234.3151010,A Big Data Architecture for Near Real-time Traffic Analytics,https://doi.org/10.1145/3147234.3151010
498,1967,/doi/10.1145/2912160.2912205,Big Data-based Smart City Platform: Real-Time Crime Analysis,https://doi.org/10.1145/2912160.2912205
499,1972,/doi/10.1145/3299815.3314439,Intrusion Detection Using Big Data and Deep Learning Techniques,https://doi.org/10.1145/3299815.3314439
500,1975,/doi/10.1145/3378904.3378919,The Role of Big Data in Enhancing Student's Sustainable Development Awareness: A Case Study in Higher Education,https://doi.org/10.1145/3378904.3378919
501,1977,/doi/10.1145/3149572.3149603,The research of Data Integration and Business Intelligent based on drilling big data,https://doi.org/10.1145/3149572.3149603
502,1980,/doi/10.1145/3006299.3006310,Neighborhood features help detecting non-technical losses in big data sets,https://doi.org/10.1145/3006299.3006310
503,1986,/doi/10.1145/3503928.3503933,"Business Planning and Big Data, Budget Modelling Upgrade Through Data Science",https://doi.org/10.1145/3503928.3503933
504,1988,/doi/10.1145/3234698.3234723,"Investigating Business Intelligence in the era of Big Data: concepts, benefits and challenges",https://doi.org/10.1145/3234698.3234723
505,1996,/doi/10.1145/3284103.3284112,Traffic State Estimation with Big Data,https://doi.org/10.1145/3284103.3284112
506,2002,/doi/10.1145/2539150.2539154,NoSQL databases - no panacea for Big Data processing,https://doi.org/10.1145/2539150.2539154
507,2004,/doi/10.1145/3404687.3404693,Research on the Big Data Platform and Its Key Technologies for the Railway Locomotive System,https://doi.org/10.1145/3404687.3404693
508,2008,/doi/10.1145/3565291.3565293,Analysis on Characteristics of Bus Passenger Flow in Big Data Environment,https://doi.org/10.1145/3565291.3565293
509,2013,/doi/10.1145/3358528.3358589,A Research of Readers' Borrowing Library Books Management and Optimization Based On Big Data Technology,https://doi.org/10.1145/3358528.3358589
510,2016,/doi/10.1145/3443467.3443723,Analysis and Research on Book Recommendation Model Based on Big Data,https://doi.org/10.1145/3443467.3443723
511,2021,/doi/10.1145/3281375.3281386,A semantic-based model to represent multimedia big data,https://doi.org/10.1145/3281375.3281386
512,2024,/doi/10.1145/3481646.3481650,Secure Big Data Management based on Secret Sharing and Verifiable Computing,https://doi.org/10.1145/3481646.3481650
513,2026,/doi/10.1145/3647444.3647880,A Study on Largescale Applications of Big Data in Modern Era,https://doi.org/10.1145/3647444.3647880
514,2030,/doi/10.14778/2752939.2752945,A performance study of big data on small nodes,https://doi.org/10.14778/2752939.2752945
515,2036,/doi/10.1145/3584748.3584751,Research on Conceptual Model of the Remote Sensing Big Data Workflow,https://doi.org/10.1145/3584748.3584751
516,2041,/doi/10.1145/3041021.3054141,When Fashion Meets Big Data: Discriminative Mining of Best Selling Clothing Features,https://doi.org/10.1145/3041021.3054141
517,2044,/doi/10.1145/3194206.3194229,Based on Hadoop's tech big data combination and mining technology framework,https://doi.org/10.1145/3194206.3194229
518,2048,/doi/10.1145/3482632.3483143,English Teaching Evaluation System Based on Big Data,https://doi.org/10.1145/3482632.3483143
519,2050,/doi/10.1145/2424840.2424842,"Some impacts of ""big data"" on usability practice",https://doi.org/10.1145/2424840.2424842
520,2052,/doi/10.1145/3314221.3314650,Panthera: holistic memory management for big data processing over hybrid memories,https://doi.org/10.1145/3314221.3314650
521,2061,/doi/10.1145/3372454.3372480,Anomaly detection for machinery by using Big Data Real-Time processing and clustering technique,https://doi.org/10.1145/3372454.3372480
522,2065,/doi/10.1145/3482632.3483150,Analysis of Japanese Teaching Data Based on Big Data,https://doi.org/10.1145/3482632.3483150
523,2067,/doi/10.1145/3564665.3564679,Research on Chinese traditional culture education in Vocational Colleges under the background of big data,https://doi.org/10.1145/3564665.3564679
524,2073,/doi/10.1145/2616498.2616525,Applying Lessons from e-Discovery to Process Big Data using HPC,https://doi.org/10.1145/2616498.2616525
525,2076,/doi/10.1145/3158421.3158427,"Big Data, the Internet of Things, and the Revised Knowledge Pyramid",https://doi.org/10.1145/3158421.3158427
526,2078,/doi/10.1145/2928294.2928295,Utilizing semantic big data for realizing a national-scale infrastructure vulnerability analysis system,https://doi.org/10.1145/2928294.2928295
527,2083,/doi/10.1145/3383923.3383964,Challenges and Countermeasures of Education in the Era of Big Data,https://doi.org/10.1145/3383923.3383964
528,2089,/doi/10.1145/3436286.3436304,The Researches on Public Service Information Security in the Context of Big Data,https://doi.org/10.1145/3436286.3436304
529,2092,/doi/10.1145/2428616.2431055,Hazy: Making it Easier to Build and Maintain Big-data Analytics: Racing to unleash the full potential of big data with the latest statistical and machine-learning techniques.,https://doi.org/10.1145/2428616.2431055
530,2096,/doi/10.1145/3659211.3659348,A Bibliometric Analysis and Visualization of Human Resource Big Data Research,https://doi.org/10.1145/3659211.3659348
531,2101,/doi/10.1145/3456887.3457492,English Translation Flipped Classroom Teaching Model Based on Big Data,https://doi.org/10.1145/3456887.3457492
532,2103,/doi/10.1145/3569966.3570077,The Exponential Dynamic Analysis of Network Attention Based on Big Data,https://doi.org/10.1145/3569966.3570077
533,2108,/doi/10.1145/3624062.3624541,OctoRay: Framework for Scalable FPGA Cluster Acceleration of Python Big Data Applications,https://doi.org/10.1145/3624062.3624541
534,2114,/doi/10.1145/3383455.3422529,Quantifying ESG alpha using scholar big data: an automated machine learning approach,https://doi.org/10.1145/3383455.3422529
535,2117,/doi/10.1109/TCBB.2015.2454551,Knowledge discovery using big data in biomedical systems,https://doi.org/10.1109/TCBB.2015.2454551
536,2122,/doi/10.1145/3318265.3318268,A unified scaling model in the era of big data analytics,https://doi.org/10.1145/3318265.3318268
537,2126,/doi/10.1145/2396636.2396678,Scalable interaction design for collaborative visual exploration of big data,https://doi.org/10.1145/2396636.2396678
538,2128,/doi/10.1145/3322134.3322135,The Connotation and Strategy of College Students' Behavior Analysis under the Background of Big Data,https://doi.org/10.1145/3322134.3322135
539,2131,/doi/10.1145/3093241.3093265,Social Login and Data Storage in the Big Data File System HDFS,https://doi.org/10.1145/3093241.3093265
540,2135,/doi/10.1145/3269206.3269208,BBoxDB - A Scalable Data Store for Multi-Dimensional Big Data,https://doi.org/10.1145/3269206.3269208
541,2138,/doi/10.1145/2896387.2900334,Secure and Efficient Big Data Gathering in Heterogeneous Wireless Sensor Networks,https://doi.org/10.1145/2896387.2900334
542,2139,/doi/10.1145/2897010.2897014,Extending search-based software testing techniques to big data applications,https://doi.org/10.1145/2897010.2897014
543,2142,/doi/10.1145/3219788.3219809,File System Performance Tuning for Standard Big Data Benchmarks,https://doi.org/10.1145/3219788.3219809
544,2145,/doi/10.1145/3598438.3598449,Analysis on the Operation Capability of Tourism Listed Companies Based on Big Data Mining,https://doi.org/10.1145/3598438.3598449
