,ner_id,link,title,doi
2325,7474,/doi/10.1007/s10845-009-0242-5,A telebiometric system mechanism model and biometric network protocol for the security of networked manufacturing,https://doi.org/10.1007/s10845-009-0242-5
2326,7476,/doi/10.1109/SecTech.2008.44,The Biometric System Models with Secure Network Protocols in Open Network Environment,https://doi.org/10.1109/SecTech.2008.44
2327,7478,/doi/10.1109/SecTech.2008.30,Implementation of the BioAPI Test Assertion to Apply a Telebiometric System Model to the National Infrastructure Establishment,https://doi.org/10.1109/SecTech.2008.30
2328,7481,/doi/10.1109/ISA.2008.24,Biometric Handshake Protocol on Telebiometric System Mechanism for National Infrastructure,https://doi.org/10.1109/ISA.2008.24
2329,7483,/doi/10.1109/WAINA.2008.289,Designing Fingerprint-Recognition-Based Access Control for Electronic Medical Records Systems,https://doi.org/10.1109/WAINA.2008.289
2330,7484,/doi/10.1109/FBIT.2007.44,Performance Evaluation Model for the Face Recognition System,https://doi.org/10.1109/FBIT.2007.44
2331,7486,/doi/10.1007/978-3-540-30501-9_173,A sparse timestamp model for managing changes in XML documents,https://doi.org/10.1007/978-3-540-30501-9_173
2332,7489,/doi/10.1109/SecTech.2008.59,A Proposal of Real-Time Status Management Protocol for Structural Desperation of a Certificate Verification Service,https://doi.org/10.1109/SecTech.2008.59
2333,7491,/doi/10.1145/3555776.3577762,MCRepair: Multi-Chunk Program Repair via Patch Optimization with Buggy Block,https://doi.org/10.1145/3555776.3577762
2334,7493,/doi/10.1145/3535444,Session details: Theme: Software design and development: SE - software engineering track,https://doi.org/10.1145/3535444
2335,7496,/doi/10.1145/3462432,Session details: Theme: Software design and development: SE - Software engineering track,https://doi.org/10.1145/3462432
2336,7497,/doi/10.1145/3389671,Session details: Theme: Software design and development: SE - Software engineering track,https://doi.org/10.1145/3389671
2337,7498,/doi/10.1145/3341105.3374005,Applying deep learning algorithm to automatic bug localization and repair,https://doi.org/10.1145/3341105.3374005
2338,7501,/doi/10.1145/3329389,Session details: Theme: Software design and development: SE - Software engineering track,https://doi.org/10.1145/3329389
2339,7502,/doi/10.1007/s00500-017-2769-2,Assessing content-based conformance between software R&D documents and design guidelines using relevance links,https://doi.org/10.1007/s00500-017-2769-2
2340,7506,/doi/10.1145/3258643,Session details: Software design and development: SE - software engineering track,https://doi.org/10.1145/3258643
2341,7507,/doi/10.1145/3243965,Session details: SE - software engineering track,https://doi.org/10.1145/3243965
2342,7508,/doi/10.1145/3019612.3019788,Analyzing emotion words to predict severity of software bugs: a case study of open source projects,https://doi.org/10.1145/3019612.3019788
2343,7510,/doi/10.1016/j.jss.2016.02.034,Towards more accurate severity prediction and fixer recommendation of software bugs,https://doi.org/10.1016/j.jss.2016.02.034
2344,7513,/doi/10.1145/3252784,"Session details: Volume II: Software design and development, and system software and security: Software engineering track",https://doi.org/10.1145/3252784
2345,7514,/doi/10.1145/3251673,"Session details: Volume II: Software development, system software and security: Software engineering track",https://doi.org/10.1145/3251673
2346,7515,/doi/10.1145/2695664.2695872,Predicting severity of bug report by mining bug repository with concept profile,https://doi.org/10.1145/2695664.2695872
2347,7517,/doi/10.1109/APSEC.2014.43,A Novel Developer Ranking Algorithm for Automatic Bug Triage Using Topic Model and Developer Relations,https://doi.org/10.1109/APSEC.2014.43
2348,7519,/doi/10.1109/COMPSAC.2014.16,Towards Semi-automatic Bug Triage and Severity Prediction Based on Topic Model and Multi-feature of Bug Reports,https://doi.org/10.1109/COMPSAC.2014.16
2349,7520,/doi/10.1145/2554850.2555008,Utilizing a multi-developer network-based developer recommendation algorithm to fix bugs effectively,https://doi.org/10.1145/2554850.2555008
2350,7521,/doi/10.1145/2480362.2480568,A hybrid bug triage algorithm for developer recommendation,https://doi.org/10.1145/2480362.2480568
2351,7522,/doi/10.1109/COMPSAC.2012.27,How to Recommend Appropriate Developers for Bug Fixing?,https://doi.org/10.1109/COMPSAC.2012.27
2352,7523,/doi/10.1109/CIT.2011.90,A Bug Rule Based Technique with Feedback for Classifying Bug Reports,https://doi.org/10.1109/CIT.2011.90
2353,7524,/doi/10.1145/1982185.1982222,Patterns for configuration requirements of Software-as-a-Service,https://doi.org/10.1145/1982185.1982222
2354,7529,/doi/10.1109/CIT.2010.243,Complementary Classification Techniques based Personalized Software Requirements Retrieval with Semantic Ontology and User Feedback,https://doi.org/10.1109/CIT.2010.243
2355,7531,/doi/10.1109/APSEC.2009.59,Extracting Development Organization from Open Source Software,https://doi.org/10.1109/APSEC.2009.59
2356,7532,/doi/10.1109/APSEC.2008.75,Providing the Guideline of Determining Quality Checklists Priorities Based on Evaluation Records of Software Products,https://doi.org/10.1109/APSEC.2008.75
2357,7534,/doi/10.1109/ICCIT.2008.122,Prioritizing Checklists for the Decision Support of Quality Evaluation Based on External Multiple Characteristics of Software,https://doi.org/10.1109/ICCIT.2008.122
2358,7535,/doi/10.1109/SERA.2008.31,Semantic and Dynamic Web Service of SOA Based Smart Robots Using Web 2.0 OpenAPI,https://doi.org/10.1109/SERA.2008.31
2359,7538,/doi/10.1109/ICISS.2008.31,Agent Based Dynamic Adaptation of Intelligent Robots Using Enterprise Service Bus,https://doi.org/10.1109/ICISS.2008.31
2360,7542,/doi/10.1109/ICCIT.2007.204,Evolving Web Service Applications Using UML and OWL-S,https://doi.org/10.1109/ICCIT.2007.204
2361,7545,/doi/10.1109/ICCIT.2007.203,Evolving Game Agents Based on Adaptive Constraint of Evolution,https://doi.org/10.1109/ICCIT.2007.203
2362,7548,/doi/10.1109/SERA.2006.33,Extending UML for Development of Distributed Control Systems with Heterogeneous Languages,https://doi.org/10.1109/SERA.2006.33
2363,7550,/doi/10.1016/j.jss.2005.06.042,A unified model for the implementation of both ISO 9001,https://doi.org/10.1016/j.jss.2005.06.042
2364,7554,/doi/10.1109/APSEC.2004.30,An Integrated Model of ISO 9001: 2000 and CMMI for ISO Registered Organizations,https://doi.org/10.1109/APSEC.2004.30
2365,7555,/doi/10.1007/11668855_9,Extending UML for a context-based navigation modeling framework of web information systems,https://doi.org/10.1007/11668855_9
2366,7557,/doi/10.1002/spe.2504,Special issue on software reuse,https://doi.org/10.1002/spe.2504
2367,7561,/doi/10.1016/j.cose.2021.102277,Neural network laundering: Removing black-box backdoor watermarks from deep neural networks,https://doi.org/10.1016/j.cose.2021.102277
2368,7565,/doi/10.1007/s11227-017-2055-1,A security evaluation framework for cloud security auditing,https://doi.org/10.1007/s11227-017-2055-1
2369,7569,/doi/10.1145/3230833.3233766,Architectural Solutions to Mitigate Security Vulnerabilities in Software Systems,https://doi.org/10.1145/3230833.3233766
2370,7571,/doi/10.1109/MC.2016.332,Architectural Approaches to Security: Four Case Studies,https://doi.org/10.1109/MC.2016.332
2371,7575,/doi/10.1145/2857546.2857609,Bypassing the Integrity Checking of Rights Objects in OMA DRM: a Case Study with the MelOn Music Service,https://doi.org/10.1145/2857546.2857609
2372,7577,/doi/10.1145/2857546.2857552,Threat Assessment in the Cloud Environment: A Quantitative Approach for Security Pattern Selection,https://doi.org/10.1145/2857546.2857552
2373,7579,/doi/10.1109/MSP.2015.126,Architectural Analysis for Security,https://doi.org/10.1109/MSP.2015.126
2374,7580,/doi/10.1109/ARES.2015.106,"Securing Web Applications with Better ""Patches"": An Architectural Approach for Systematic Input Validation with Security Patterns",https://doi.org/10.1109/ARES.2015.106
2375,7582,/doi/10.1145/2701126.2701226,A stakeholder-oriented assessment index for cloud security auditing,https://doi.org/10.1145/2701126.2701226
2376,7584,/doi/10.1145/2701126.2701206,KaaSP: keying as a service provider for small and medium enterprises using untrusted cloud services,https://doi.org/10.1145/2701126.2701206
2377,7585,/doi/10.1109/ARES.2014.72,Building Sustainable Software by Preemptive Architectural Design Using Tactic-Equipped Patterns,https://doi.org/10.1109/ARES.2014.72
2378,7588,/doi/10.1109/ARES.2014.71,Vulnerability-Based Security Pattern Categorization in Search of Missing Patterns,https://doi.org/10.1109/ARES.2014.71
2379,7589,/doi/10.1109/SERE-C.2012.18,"Revising a Security Tactics Hierarchy through Decomposition, Reclassification, and Derivation",https://doi.org/10.1109/SERE-C.2012.18
2380,7591,/doi/10.1504/IJMC.2011.040145,Security management in Wireless Sensor Networks for healthcare,https://doi.org/10.1504/IJMC.2011.040145
2381,7595,/doi/10.1145/1734263.1734369,Development and application of a web-based programming learning system with LED display kits,https://doi.org/10.1145/1734263.1734369
2382,7597,/doi/10.1109/HICSS.2010.18,A Methodology for Mining Security Tactics from Security Patterns,https://doi.org/10.1109/HICSS.2010.18
2383,7599,/doi/10.1109/MC.2009.193,In Search of Architectural Patterns for Software Security,https://doi.org/10.1109/MC.2009.193
2384,7600,/doi/10.1145/1555619.1555660,The design and evaluation of a virtual world-based learning environment: information security learning using Second Life,https://doi.org/10.1145/1555619.1555660
2385,7604,/doi/10.1016/j.jss.2008.12.047,Engaging the net generation with evidence-based software engineering through a community-driven web database,https://doi.org/10.1016/j.jss.2008.12.047
2386,7606,/doi/10.1504/IJEF.2009.024268,Authentication and protection for e-finance consumers: the dichotomy of cost versus ease of use,https://doi.org/10.1504/IJEF.2009.024268
2387,7610,/doi/10.1109/MSP.2009.49,Security Education Using Second Life,https://doi.org/10.1109/MSP.2009.49
2388,7611,/doi/10.1504/IJMC.2009.022444,A multi-dimensional classification framework for developing context-specific Wireless Local Area Network attack taxonomies,https://doi.org/10.1504/IJMC.2009.022444
2389,7613,/doi/10.1109/CSEET.2008.29,Seeds of Evidence: Integrating Evidence-Based Software Engineering,https://doi.org/10.1109/CSEET.2008.29
2390,7614,/doi/10.1109/CSEET.2008.26,Teaching Object-Oriented Software Engineering through Problem-Based Learning in the Context of Game Design,https://doi.org/10.1109/CSEET.2008.26
2391,7616,/doi/10.1016/j.jss.2006.02.045,AVDL: a highly adaptable architecture view description language,https://doi.org/10.1016/j.jss.2006.02.045
2392,7618,/doi/10.1145/3579856.3595790,Going Haywire: False Friends in Federated Learning and How to Find Them,https://doi.org/10.1145/3579856.3595790
2393,7621,/doi/10.1145/3307334.3328625,The Light Will Be with You. Always -- A Novel Continuous Mobile Authentication with the Light Sensor (poster),https://doi.org/10.1145/3307334.3328625
2394,7623,/doi/10.1145/3196494.3201590,POSTER: I Can't Hear This Because I Am Human: A Novel Design of Audio CAPTCHA System,https://doi.org/10.1145/3196494.3201590
2395,7625,/doi/10.1145/3196494.3201581,POSTER: DeepCRACk: Using Deep Learning to Automatically CRack Audio CAPTCHAs,https://doi.org/10.1145/3196494.3201581
2396,7626,/doi/10.1007/978-3-031-57540-2_4,Evaluating Deep Learning for Cross-Domains Fake News Detection,https://doi.org/10.1007/978-3-031-57540-2_4
2397,7628,/doi/10.1007/978-3-031-54204-6_18,AddShare: A Privacy-Preserving Approach for Federated Learning,https://doi.org/10.1007/978-3-031-54204-6_18
2398,7632,/doi/10.1007/978-3-031-45275-8_47,Toward Streamlining the Evaluation of Novelty Detection in Data Streams,https://doi.org/10.1007/978-3-031-45275-8_47
2399,7634,/doi/10.1007/978-3-031-45275-8_45,HEART: Heterogeneous Log Anomaly Detection Using Robust Transformers,https://doi.org/10.1007/978-3-031-45275-8_45
2400,7637,/doi/10.1007/978-3-031-45275-8_36,Unsupervised Graph Neural Networks for Source Code Similarity Detection,https://doi.org/10.1007/978-3-031-45275-8_36
2401,7641,/doi/10.1007/978-3-031-26422-1_48,ImbalancedLearningRegression - A Python Package to Tackle the Imbalanced Regression Problem,https://doi.org/10.1007/978-3-031-26422-1_48
2402,7644,/doi/10.1007/s10994-022-06282-w,Automated imbalanced classification via layered learning,https://doi.org/10.1007/s10994-022-06282-w
2403,7648,/doi/10.1016/j.eswa.2022.117553,COVID-19 malicious domain names classification▪,https://doi.org/10.1016/j.eswa.2022.117553
2404,7649,/doi/10.1007/978-3-031-08147-7_26,An Extensive Comparison of Systems for Entity Extraction from Log Files,https://doi.org/10.1007/978-3-031-08147-7_26
2405,7651,/doi/10.1007/978-3-030-88942-5_6,An Analysis of Performance Metrics for Imbalanced Classification,https://doi.org/10.1007/978-3-030-88942-5_6
2406,7653,/doi/10.1007/978-3-030-33778-0_1,The CURE for Class Imbalance,https://doi.org/10.1007/978-3-030-33778-0_1
2407,7654,/doi/10.1016/j.neucom.2018.11.100,Pre-processing approaches for imbalanced distributions in regression,https://doi.org/10.1016/j.neucom.2018.11.100
2408,7656,/doi/10.1007/978-3-030-01771-2_9,MetaUtil: Meta Learning for Utility Maximization in Regression,https://doi.org/10.1007/978-3-030-01771-2_9
2409,7657,/doi/10.1007/s00354-017-0019-x,A Framework for Recommendation of Highly Popular News Lacking Social Feedback,https://doi.org/10.1007/s00354-017-0019-x
2410,7660,/doi/10.1007/978-3-319-65340-2_42,Exploring Resampling with Neighborhood Bias on Imbalanced Regression Problems,https://doi.org/10.1007/978-3-319-65340-2_42
2411,7661,/doi/10.1111/exsy.12081,Resampling strategies for regression,https://doi.org/10.1111/exsy.12081
2412,7662,/doi/10.1007/978-3-540-76888-3_4,Collaborative Data Synchronization in an Instance-Mapped P2P Data Sharing System,https://doi.org/10.1007/978-3-540-76888-3_4
2413,7664,/doi/10.1007/978-3-540-76848-7_12,Acquaintance Based Consistency in an Instance-Mapped P2P Data Sharing System During Transaction Processing,https://doi.org/10.1007/978-3-540-76848-7_12
2414,7665,/doi/10.1145/3530991,Unsupervised Dynamic Sensor Selection for IoT-Based Predictive Maintenance of a Fleet of Public Transport Buses,https://doi.org/10.1145/3530991
2415,7667,/doi/10.1007/978-3-030-47358-7_39,Exploring Deep Anomaly Detection Methods Based on Capsule Net,https://doi.org/10.1007/978-3-030-47358-7_39
2416,7671,/doi/10.1016/j.ins.2018.12.007,Spark-GHSOM: Growing Hierarchical Self-Organizing Map for large scale mixed attribute datasets,https://doi.org/10.1016/j.ins.2018.12.007
2417,7675,/doi/10.1109/ROSE.2019.8790427,Navigational data imputation with GPS pinning in compositional Kalman filter for IoT systems,https://doi.org/10.1109/ROSE.2019.8790427
2418,7678,/doi/10.1016/j.procs.2019.04.184,IoT-based predictive maintenance for fleet management,https://doi.org/10.1016/j.procs.2019.04.184
2419,7680,/doi/10.1007/s10844-011-0166-3,Tableaux-based optimization of schema mappings for data integration,https://doi.org/10.1007/s10844-011-0166-3
2420,7683,/doi/10.1016/j.datak.2010.12.003,Transaction processing in a peer to peer database network,https://doi.org/10.1016/j.datak.2010.12.003
2421,7684,/doi/10.1145/1966357.1966362,"Matching dependencies with arbitrary attribute values: semantics, query answering and integrity constraints",https://doi.org/10.1145/1966357.1966362
2422,7687,/doi/10.1145/1923947.1923987,Next generation business intelligence (BI) tools,https://doi.org/10.1145/1923947.1923987
2423,7692,/doi/10.1007/s10844-009-0093-8,Synthesizing advanced transaction models using the situation calculus,https://doi.org/10.1007/s10844-009-0093-8
2424,7694,/doi/10.14778/1920841.1921038,Peer coordination through distributed triggers,https://doi.org/10.14778/1920841.1921038
2425,7698,/doi/10.1145/1807167.1807201,"GRN model of probabilistic databases: construction, transition and querying",https://doi.org/10.1145/1807167.1807201
2426,7701,/doi/10.1007/978-3-540-70939-8_16,A Generalized Approach to Word Segmentation Using Maximum Length Descending Frequency and Entropy Rate,https://doi.org/10.1007/978-3-540-70939-8_16
2427,7704,/doi/10.1007/s10844-007-0050-3,Specifying active databases as non-Markovian theories of actions,https://doi.org/10.1007/s10844-007-0050-3
2428,7705,/doi/10.1007/s00778-007-0067-9,Applications of corpus-based semantic similarity and word segmentation to database schema matching,https://doi.org/10.1007/s00778-007-0067-9
2429,7707,/doi/10.1145/1379350.1379355,Maintaining consistency in a failure-prone P2P database network during transaction processing,https://doi.org/10.1145/1379350.1379355
2430,7708,/doi/10.1109/ISM.2006.105,MeTaMaF: Metadata Tagging and Mapping Framework for Managing Multimedia Content,https://doi.org/10.1109/ISM.2006.105
2431,7711,/doi/10.1007/11914853_3,Distributed triggers for peer data management,https://doi.org/10.1007/11914853_3
2432,7714,/doi/10.1007/11687238_63,An ECA rule rewriting mechanism for peer data management systems,https://doi.org/10.1007/11687238_63
2433,7716,/doi/10.1007/11575771_20,Don’t mind your vocabulary: data sharing across heterogeneous peers,https://doi.org/10.1007/11575771_20
2434,7718,/doi/10.1145/945721.945733,The hyperion project: from data integration to data coordination,https://doi.org/10.1145/945721.945733
2435,7722,/doi/10.1145/3527174,Explanation-Driven HCI Model to Examine the Mini-Mental State for Alzheimer’s Disease,https://doi.org/10.1145/3527174
2436,7728,/doi/10.1145/3533430,Stance-level Sarcasm Detection with BERT and Stance-centered Graph Attention Networks,https://doi.org/10.1145/3533430
2437,7734,/doi/10.1016/j.comcom.2022.09.021,A user-centric privacy-preserving authentication protocol for IoT-AmI environments,https://doi.org/10.1016/j.comcom.2022.09.021
2438,7738,/doi/10.1007/s00530-021-00857-8,A light-weight convolutional Neural Network Architecture for classification of COVID-19 chest X-Ray images,https://doi.org/10.1007/s00530-021-00857-8
2439,7739,/doi/10.1007/s00530-021-00769-7,DL-CNN-based approach with image processing techniques for diagnosis of retinal diseases,https://doi.org/10.1007/s00530-021-00769-7
2440,7745,/doi/10.1007/s00521-022-07090-y,RETRACTED ARTICLE: IoT-based real-time patients vital physiological parameters monitoring system using smart wearable sensors,https://doi.org/10.1007/s00521-022-07090-y
2441,7750,/doi/10.1145/3470976,A Convolutional Neural Network Model Using Weighted Loss Function to Detect Diabetic Retinopathy,https://doi.org/10.1145/3470976
2442,7753,/doi/10.1155/2022/5140148,Explainable AI in Diagnosing and Anticipating Leukemia Using Transfer Learning Method,https://doi.org/10.1155/2022/5140148
2443,7761,/doi/10.1016/j.compeleceng.2021.107530,IOT-based service migration for connected communities,https://doi.org/10.1016/j.compeleceng.2021.107530
2444,7766,/doi/10.1145/3418355,Pre-Trained Convolutional Neural Networks for Breast Cancer Detection Using Ultrasound Images,https://doi.org/10.1145/3418355
2445,7774,/doi/10.1016/j.compeleceng.2021.107209,Blockchain and homomorphic encryption-based privacy-preserving data aggregation model in smart grid,https://doi.org/10.1016/j.compeleceng.2021.107209
2446,7776,/doi/10.1145/3418500,CROWD: Crow Search and Deep Learning based Feature Extractor for Classification of Parkinson’s Disease,https://doi.org/10.1145/3418500
2447,7780,/doi/10.1007/s00530-021-00794-6,Medical image-based detection of COVID-19 using Deep Convolution Neural Networks,https://doi.org/10.1007/s00530-021-00794-6
2448,7784,/doi/10.1155/2021/9984453,A Cost-Efficient Autonomous Air Defense System for National Security,https://doi.org/10.1155/2021/9984453
2449,7790,/doi/10.1155/2021/9924478,An Efficient Three-Phase Fuzzy Logic Clone Node Detection Model,https://doi.org/10.1155/2021/9924478
2450,7796,/doi/10.1155/2021/7147940,A Metaheuristic Approach to Secure Multimedia Big Data for IoT-Based Smart City Applications,https://doi.org/10.1155/2021/7147940
2451,7802,/doi/10.1155/2021/5835806,Performance Analysis of WOFDM-WiMAX Integrating Diverse Wavelets for 5G Applications,https://doi.org/10.1155/2021/5835806
2452,7810,/doi/10.1155/2021/5592454,A Detailed Research on Human Health Monitoring System Based on Internet of Things,https://doi.org/10.1155/2021/5592454
2453,7819,/doi/10.1155/2021/5583874,A New Hybrid Deep Learning Algorithm for Prediction of Wide Traffic Congestion in Smart Cities,https://doi.org/10.1155/2021/5583874
2454,7825,/doi/10.1155/2021/5543720,Multimedia Concepts on Object Detection and Recognition with F1 Car Simulation Using Convolutional Layers,https://doi.org/10.1155/2021/5543720
2455,7830,/doi/10.1155/2021/5123671,Spoken Language Identification Using Deep Learning,https://doi.org/10.1155/2021/5123671
2456,7836,/doi/10.1155/2021/1299870,Predicting the Risk of Depression Based on ECG Using RNN,https://doi.org/10.1155/2021/1299870
2457,7840,/doi/10.1155/2020/8895429,Leveraging Deep Learning Techniques for Malaria Parasite Detection Using Mobile Application,https://doi.org/10.1155/2020/8895429
2458,7841,/doi/10.1155/2020/8893494,Light Deep Model for Pulmonary Nodule Detection from CT Scan Images for Mobile Devices,https://doi.org/10.1155/2020/8893494
2459,7842,/doi/10.1007/s11042-017-4621-1,Cloud-oriented emotion feedback-based Exergames framework,https://doi.org/10.1007/s11042-017-4621-1
2460,7848,/doi/10.1007/s11042-017-5294-5,Secure data-exchange protocol in a cloud-based collaborative health care environment,https://doi.org/10.1007/s11042-017-5294-5
2461,7849,/doi/10.1007/s11042-015-2846-4,WhatsUpNow: urban social application with real-time peer-to-peer ambient and sensory data exchanges,https://doi.org/10.1007/s11042-015-2846-4
2462,7852,/doi/10.1016/j.chb.2016.04.021,Design and evaluation of hospital-based business intelligence system (HBIS),https://doi.org/10.1016/j.chb.2016.04.021
2463,7858,/doi/10.1016/j.chb.2016.02.094,Collaborative e-learning systems using semantic data interoperability,https://doi.org/10.1016/j.chb.2016.02.094
2464,7859,/doi/10.1155/2015/914305,Tracking and repairing damaged healthcare databases using the matrix,https://doi.org/10.1155/2015/914305
2465,7863,/doi/10.1016/j.chb.2014.10.002,Usability of a cloud-based collaborative learning framework to improve learners' experience,https://doi.org/10.1016/j.chb.2014.10.002
2466,7866,/doi/10.1016/j.chb.2014.09.047,Well-formed semantic model for co-learning,https://doi.org/10.1016/j.chb.2014.09.047
2467,7870,/doi/10.4018/IJKSR.2015070102,Knowledge Update in Collaborative Knowledge Sharing Systems,https://doi.org/10.4018/IJKSR.2015070102
2468,7871,/doi/10.1007/s11042-014-1973-7,Spectro-temporal directional derivative based automatic speech recognition for a serious game scenario,https://doi.org/10.1007/s11042-014-1973-7
2469,7874,/doi/10.1155/2015/615740,An enhanced k-means clustering algorithm for pattern discovery in healthcare data,https://doi.org/10.1155/2015/615740
2470,7876,/doi/10.1016/j.chb.2013.06.019,Automated and user involved data synchronization in collaborative e-health environments,https://doi.org/10.1016/j.chb.2013.06.019
2471,7878,/doi/10.1109/TITB.2012.2202244,Data Interoperability and Multimedia Content Management in e-Health Systems,https://doi.org/10.1109/TITB.2012.2202244
2472,7879,/doi/10.1504/IJICA.2012.046779,Knowledge-based image segmentation using swarm intelligence techniques,https://doi.org/10.1504/IJICA.2012.046779
2473,7882,/doi/10.1504/IJIIDS.2011.042534,Concurrent execution of transactions in a peer-to-peer database network,https://doi.org/10.1504/IJIIDS.2011.042534
2474,7883,/doi/10.1109/ICME.2011.6012209,Interoperability and data sharing settings in a healthcare data management system,https://doi.org/10.1109/ICME.2011.6012209
2475,7884,/doi/10.1504/IJKEDM.2010.034840,Query translation between sources in peer-to-peer database sharing systems,https://doi.org/10.1504/IJKEDM.2010.034840
2476,7885,/doi/10.1007/s10586-022-03705-0,An AI-empowered affect recognition model for healthcare and emotional well-being using physiological signals,https://doi.org/10.1007/s10586-022-03705-0
2477,7891,/doi/10.1007/s10586-022-03678-0,AI-based Bayesian inference scheme to recognize electroencephalogram signals for smart healthcare,https://doi.org/10.1007/s10586-022-03678-0
2478,7895,/doi/10.1007/s00530-021-00800-x,Deep learning and evolutionary intelligence with fusion-based feature extraction for detection of COVID-19 from chest X-ray images,https://doi.org/10.1007/s00530-021-00800-x
2479,7898,/doi/10.1007/s00530-021-00787-5,An explainable stacked ensemble of deep learning models for improved melanoma skin cancer detection,https://doi.org/10.1007/s00530-021-00787-5
2480,7899,/doi/10.1007/s00530-021-00782-w,AI inspired EEG-based spatial feature selection method using multivariate empirical mode decomposition for emotion classification,https://doi.org/10.1007/s00530-021-00782-w
2481,7902,/doi/10.1155/2022/8512469,Enhancement of Detection of Diabetic Retinopathy Using Harris Hawks Optimization with Deep Learning Model,https://doi.org/10.1155/2022/8512469
2482,7910,/doi/10.1155/2022/3098604,"Impact of Activation, Optimization, and Regularization Methods on the Facial Expression Model Using CNN",https://doi.org/10.1155/2022/3098604
2483,7920,/doi/10.1145/3453186,MEC-Based Jamming-Aided Anti-Eavesdropping with Deep Reinforcement Learning for WBANs,https://doi.org/10.1145/3453186
2484,7925,/doi/10.1145/3426970,Predictive Analytics of Energy Usage by IoT-Based Smart Home Appliances for Green Urban Development,https://doi.org/10.1145/3426970
2485,7926,/doi/10.1145/3469841,An Explainable Deep Learning Ensemble Model for Robust Diagnosis of Diabetic Retinopathy Grading,https://doi.org/10.1145/3469841
