,ner_id,link,title,doi
1527,5196,/doi/10.1145/2320765.2320788,Cost models for view materialization in the cloud,https://doi.org/10.1145/2320765.2320788
1528,5200,/doi/10.4018/jdwm.2012010102,Spatial OLAP and Map Generalization: Model and Algebra,https://doi.org/10.4018/jdwm.2012010102
1529,5203,/doi/10.4018/jtd.2011070104,Using OCL to Model Constraints in Data Warehouses,https://doi.org/10.4018/jtd.2011070104
1530,5206,/doi/10.1145/1871940.1871948,Towards the definition of spatial data warehouses integrity constraints with spatial OCL,https://doi.org/10.1145/1871940.1871948
1531,5208,/doi/10.4018/jdwm.2010100103,When Spatial Analysis Meets OLAP: Multidimensional Model and Operators,https://doi.org/10.4018/jdwm.2010100103
1532,5211,/doi/10.1109/ICDMW.2008.80,Enriching Spatial OLAP with Map Generalization: a Conceptual Multidimensional Model,https://doi.org/10.1109/ICDMW.2008.80
1533,5212,/doi/10.1007/978-3-540-89903-7_2,HyperSmooth: A System for Interactive Spatial Analysis Via Potential Maps,https://doi.org/10.1007/978-3-540-89903-7_2
1534,5219,/doi/10.1007/978-3-540-69839-5_24,Integration of Geographic Information into Multidimensional Models,https://doi.org/10.1007/978-3-540-69839-5_24
1535,5220,/doi/10.1007/11915072_66,GeWOlap: a web based spatial OLAP proposal,https://doi.org/10.1007/11915072_66
1536,5222,/doi/10.1007/11890393_11,"GeoCube, a multidimensional model and navigation operators handling complex measures: application in spatial OLAP",https://doi.org/10.1007/11890393_11
1537,5223,/doi/10.1145/1097002.1097009,Towards a spatial multidimensional model,https://doi.org/10.1145/1097002.1097009
1538,5224,/doi/10.1007/s11042-022-13694-2,Development iterations based on web augmentation and context tasks,https://doi.org/10.1007/s11042-022-13694-2
1539,5229,/doi/10.1016/j.compag.2020.105242,Using LEL and scenarios to derive mathematical programming models. Application in a fresh tomato packing problem,https://doi.org/10.1016/j.compag.2020.105242
1540,5234,/doi/10.1007/s00766-013-0193-4,Early identification of crosscutting concerns with the Language Extended Lexicon,https://doi.org/10.1007/s00766-013-0193-4
1541,5237,/doi/10.1145/1774088.1774147,Early identification of crosscutting concerns in the domain model guided by states,https://doi.org/10.1145/1774088.1774147
1542,5238,/doi/10.1109/DEXA.2009.44,Embedding Security Patterns into a Domain Model,https://doi.org/10.1109/DEXA.2009.44
1543,5241,/doi/10.1007/s11219-023-09652-2,UX debt in an agile development process: evidence and characterization,https://doi.org/10.1007/s11219-023-09652-2
1544,5245,/doi/10.1016/j.csi.2022.103633,ANDES: An approach to embed search services on the Web browser,https://doi.org/10.1016/j.csi.2022.103633
1545,5252,/doi/10.1016/j.infsof.2021.106735,Engineering Web Augmentation software: A development method for enabling end-user maintenance,https://doi.org/10.1016/j.infsof.2021.106735
1546,5256,/doi/10.1007/s11042-020-09803-8,Engaging end-user driven recommender systems: personalization through web augmentation,https://doi.org/10.1007/s11042-020-09803-8
1547,5259,/doi/10.1007/s10270-020-00779-5,MDWA: a model-driven Web augmentation approach—coping with client- and server-side support,https://doi.org/10.1007/s10270-020-00779-5
1548,5263,/doi/10.1145/3397877,UX-Painter: An Approach to Explore Interaction Fixes in the Browser,https://doi.org/10.1145/3397877
1549,5264,/doi/10.1007/978-3-030-50578-3_31,An Approach to Build P2P Web Extensions,https://doi.org/10.1007/978-3-030-50578-3_31
1550,5267,/doi/10.5220/0008559304770486,A Web-based Model-driven Platform for Web Augmentation,https://doi.org/10.5220/0008559304770486
1551,5269,/doi/10.1007/978-3-030-19274-7_17,An End-User Pipeline for Scraping and Visualizing Semi-Structured Data over the Web,https://doi.org/10.1007/978-3-030-19274-7_17
1552,5272,/doi/10.1007/s11219-018-9413-y,Usability improvement through A/B testing and refactoring,https://doi.org/10.1007/s11219-018-9413-y
1553,5274,/doi/10.1007/s10270-017-0586-9,DataMock: An Agile Approach for Building Data Models from User Interface Mockups,https://doi.org/10.1007/s10270-017-0586-9
1554,5277,/doi/10.1145/3238147.3240483,Live versioning of web applications through refactoring,https://doi.org/10.1145/3238147.3240483
1555,5278,/doi/10.1007/978-3-319-91662-0_24,Towards Full End-Users Control of Social Recommendations,https://doi.org/10.1007/978-3-319-91662-0_24
1556,5279,/doi/10.1007/978-3-319-91662-0_12,Improving Legacy Applications with Client-Side Augmentations,https://doi.org/10.1007/978-3-319-91662-0_12
1557,5283,/doi/10.1145/3151759.3151801,iVOLUNTEER: a digital ecosystem for life-long volunteering,https://doi.org/10.1145/3151759.3151801
1558,5291,/doi/10.1145/3199919.3199923,Web of Things Augmentation,https://doi.org/10.1145/3199919.3199923
1559,5294,/doi/10.1109/ICSE-C.2017.127,End-user software engineering for the personal web: poster,https://doi.org/10.1109/ICSE-C.2017.127
1560,5295,/doi/10.1007/978-3-319-46963-8_20,Flexible Distribution of Existing Web Interfaces: An Architecture Involving Developers and End-Users,https://doi.org/10.1007/978-3-319-46963-8_20
1561,5296,/doi/10.1007/s10664-015-9384-6,Assessing refactorings for usability in e-commerce applications,https://doi.org/10.1007/s10664-015-9384-6
1562,5298,/doi/10.1007/s11219-014-9248-0,A framework and tool to manage Cloud Computing service quality,https://doi.org/10.1007/s11219-014-9248-0
1563,5303,/doi/10.1145/2824893.2824908,Enactive sketches for designing enactive interactions,https://doi.org/10.1145/2824893.2824908
1564,5305,/doi/10.1007/978-3-319-19890-3_11,User Interface Adaptation Using Web Augmentation Techniques: Towards a Negotiated Approach,https://doi.org/10.1007/978-3-319-19890-3_11
1565,5306,/doi/10.1007/s10660-014-9149-0,Business processes refactoring to improve usability in E-commerce applications,https://doi.org/10.1007/s10660-014-9149-0
1566,5309,/doi/10.1007/s10209-013-0323-2,Improving accessibility of Web interfaces: refactoring to the rescue,https://doi.org/10.1007/s10209-013-0323-2
1567,5311,/doi/10.1145/2662253.2662292,Sketching for designing enactive interactions,https://doi.org/10.1145/2662253.2662292
1568,5313,/doi/10.1016/j.infsof.2014.01.011,Mockup-Driven Development: Providing agile support for Model-Driven Web Engineering,https://doi.org/10.1016/j.infsof.2014.01.011
1569,5316,/doi/10.1145/251453.2591454,The 25th ACM International Conference on Hypertext and Social Media,https://doi.org/10.1145/251453.2591454
1570,5321,/doi/10.1007/s11334-013-0206-y,Web-GIS models: accomplishing modularity with aspects,https://doi.org/10.1007/s11334-013-0206-y
1571,5325,/doi/10.1016/j.ijhcs.2013.08.014,An approach for supporting distributed user interface orchestration over the Web,https://doi.org/10.1016/j.ijhcs.2013.08.014
1572,5327,/doi/10.1016/j.jss.2013.05.045,Detecting Web requirements conflicts and inconsistencies under a model-based perspective,https://doi.org/10.1016/j.jss.2013.05.045
1573,5329,/doi/10.1109/WSE.2013.6642420,Managing volatile requirements in web applications,https://doi.org/10.1109/WSE.2013.6642420
1574,5330,/doi/10.1007/978-3-642-39200-9_4,MockAPI: an agile approach supporting API-first web application development,https://doi.org/10.1007/978-3-642-39200-9_4
1575,5332,/doi/10.1007/978-3-642-39200-9_20,A domain specific language for orchestrating user tasks whilst navigation web sites,https://doi.org/10.1007/978-3-642-39200-9_20
1576,5333,/doi/10.1007/978-3-319-04244-2_31,MockupDD: Facilitating Agile Support for Model-Driven Web Engineering,https://doi.org/10.1007/978-3-319-04244-2_31
1577,5334,/doi/10.1007/978-3-319-04244-2_21,Crowdsourcing Mobile Web Applications,https://doi.org/10.1007/978-3-319-04244-2_21
1578,5336,/doi/10.1109/MIC.2012.143,Personalized Web Accessibility using Client-Side Refactoring,https://doi.org/10.1109/MIC.2012.143
1579,5339,/doi/10.1007/s10270-011-0196-x,Guest Editorial to the Theme Section on Model-Driven Web Engineering,https://doi.org/10.1007/s10270-011-0196-x
1580,5342,/doi/10.1145/2428736.2428765,NDT-merge: a future tool for conciliating software requirements in MDE environments,https://doi.org/10.1145/2428736.2428765
1581,5344,/doi/10.1145/2428736.2428751,Modelling adaptations requirements in web workflows,https://doi.org/10.1145/2428736.2428751
1582,5345,/doi/10.1109/WSE.2012.6320542,Welcome from the chairs,https://doi.org/10.1109/WSE.2012.6320542
1583,5347,/doi/10.1007/978-3-642-35623-0_15,Identifying and modelling complex workflow requirements in web applications,https://doi.org/10.1007/978-3-642-35623-0_15
1584,5348,/doi/10.1007/978-3-642-31753-8_20,Supporting users tasks with personal information management and web forms augmentation,https://doi.org/10.1007/978-3-642-31753-8_20
1585,5351,/doi/10.1007/978-3-642-31753-8_15,From requirements to web applications in an agile model-driven approach,https://doi.org/10.1007/978-3-642-31753-8_15
1586,5354,/doi/10.1109/MITP.2012.79,IT in Emerging Markets,https://doi.org/10.1109/MITP.2012.79
1587,5357,/doi/10.1504/IJWET.2012.045764,Improving the model view controller paradigm in the web,https://doi.org/10.1504/IJWET.2012.045764
1588,5363,/doi/10.1145/2095536.2095568,Making workflows situation aware: an ontology-driven framework for dynamic spatial systems,https://doi.org/10.1145/2095536.2095568
1589,5369,/doi/10.1007/s00766-011-0124-1,WebSpec: a visual language for specifying interaction and navigation requirements in web applications,https://doi.org/10.1007/s00766-011-0124-1
1590,5370,/doi/10.1145/2038476.2038515,An approach and tool support for assisting users to fill-in web forms with personal information,https://doi.org/10.1145/2038476.2038515
1591,5374,/doi/10.1007/978-3-642-27997-3_34,A flexible architecture for client-side adaptation,https://doi.org/10.1007/978-3-642-27997-3_34
1592,5375,/doi/10.1007/978-3-642-27997-3_27,Detecting conflicts and inconsistencies in web application requirements,https://doi.org/10.1007/978-3-642-27997-3_27
1593,5376,/doi/10.1109/MS.2010.114,Refactoring for Usability in Web Applications,https://doi.org/10.1109/MS.2010.114
1594,5377,/doi/10.1145/1969289.1969302,Accessibility at early stages: insights from the designer perspective,https://doi.org/10.1145/1969289.1969302
1595,5380,/doi/10.1007/978-3-642-17616-6_49,An Incremental Approach for Building Accessible and Usable Web Applications,https://doi.org/10.1007/978-3-642-17616-6_49
1596,5382,/doi/10.1007/s11280-010-0091-3,Engineering Accessible Web Applications. An Aspect-Oriented Approach,https://doi.org/10.1007/s11280-010-0091-3
1597,5383,/doi/10.1109/QUATIC.2010.23,Improving the Quality of Web-GIS Modularity Using Aspects,https://doi.org/10.1109/QUATIC.2010.23
1598,5384,/doi/10.1016/j.jss.2009.11.002,Dealing with variability in context-aware mobile software,https://doi.org/10.1016/j.jss.2009.11.002
1599,5386,/doi/10.1145/1810295.1810359,A flexible tool suite for change-aware test-driven development of web applications,https://doi.org/10.1145/1810295.1810359
1600,5387,/doi/10.1109/MIC.2010.76,Rich Internet Applications,https://doi.org/10.1109/MIC.2010.76
1601,5390,/doi/10.1007/s11280-010-0083-3,Erratum to: Engineering Issues for the Web 2.0,https://doi.org/10.1007/s11280-010-0083-3
1602,5393,/doi/10.1007/s11280-009-0071-7,Engineering Issues for the Web 2.0,https://doi.org/10.1007/s11280-009-0071-7
1603,5394,/doi/10.1007/978-3-642-05290-3_17,Rethinking Context Models,https://doi.org/10.1007/978-3-642-05290-3_17
1604,5396,/doi/10.1145/1735935.1735941,Meteoroid towards a real MVC for the web,https://doi.org/10.1145/1735935.1735941
1605,5399,/doi/10.1007/978-3-642-02818-2_10,Bridging Test and Model-Driven Approaches in Web Engineering,https://doi.org/10.1007/978-3-642-02818-2_10
1606,5400,/doi/10.1145/1497185.1497222,Model-based concerns mashups for mobile hypermedia,https://doi.org/10.1145/1497185.1497222
1607,5401,/doi/10.1109/ICWE.2008.41,Refactoring to Rich Internet Applications. A Model-Driven Approach,https://doi.org/10.1109/ICWE.2008.41
1608,5403,/doi/10.1007/978-3-540-69534-9_32,Concern-Sensitive Navigation: Improving Navigation in Web Software through Separation of Concerns,https://doi.org/10.1007/978-3-540-69534-9_32
1609,5407,/doi/10.1504/IJWET.2007.011527,A comprehensive design model for integrating business processes in web applications,https://doi.org/10.1504/IJWET.2007.011527
1610,5409,/doi/10.1145/3605098.3636013,UX-Analyzer: Visualizing the interaction effort for web analytics,https://doi.org/10.1145/3605098.3636013
1611,5410,/doi/10.1145/3233824.3233844,"Beyond the GUI in agriculture: a bibliographic review, challenges and opportunities",https://doi.org/10.1145/3233824.3233844
1612,5412,/doi/10.1007/978-3-662-44811-3_6,Extending OpenUP to Conform with the ISO Usability Maturity Model,https://doi.org/10.1007/978-3-662-44811-3_6
1613,5413,/doi/10.1177/01655515211001787,Usability of data-oriented user interfaces for cultural heritage: A systematic mapping study,https://doi.org/10.1177/01655515211001787
1614,5416,/doi/10.1007/978-3-031-54975-5_7,In Search of Dark Patterns in Chatbots,https://doi.org/10.1007/978-3-031-54975-5_7
1615,5418,/doi/10.1145/3233824.3233852,A Mixed Usability Evaluation on a Multi Criteria Group Decision Support System in Agriculture,https://doi.org/10.1145/3233824.3233852
1616,5421,/doi/10.1109/AINAW.2007.30,A Modular Architecture for Context Sensing,https://doi.org/10.1109/AINAW.2007.30
1617,5422,/doi/10.1145/3404983.3410000,Dynamic indoor navigation and orientation system for people with impairments,https://doi.org/10.1145/3404983.3410000
1618,5429,/doi/10.1109/IST.2016.7738282,Signal fusion based on intensity and motion variations for remote heart rate determination,https://doi.org/10.1109/IST.2016.7738282
1619,5432,/doi/10.5220/0005694002400246,Remote Heart Rate Determination in RGB Data,https://doi.org/10.5220/0005694002400246
1620,5435,/doi/10.5220/0005658804150422,Activity Recognition based on High-Level Reasoning,https://doi.org/10.5220/0005658804150422
1621,5438,/doi/10.5220/0005178700220029,Mobility Assessment of Demented People Using Pose Estimation and Movement Detection,https://doi.org/10.5220/0005178700220029
1622,5439,/doi/10.1145/3630048.3630181,Adaptive Decentralized Federated Gossip Learning for Resource-Constrained IoT Devices,https://doi.org/10.1145/3630048.3630181
1623,5444,/doi/10.1109/ETFA52439.2022.9921684,Approximate Fast Fourier Transform-based Preprocessing for Edge AI,https://doi.org/10.1109/ETFA52439.2022.9921684
1624,5446,/doi/10.1109/RFID.2012.9,Flexible Development and Testing Environment for Implementation of New Algorithms in RFID Systems,https://doi.org/10.1109/RFID.2012.9
1625,5449,/doi/10.1007/s00138-024-01534-2,OmniGlasses: an optical aid for stereo vision CNNs to enable omnidirectional image processing,https://doi.org/10.1007/s00138-024-01534-2
1626,5454,/doi/10.1145/3375923.3375943,Estimation of Gait Parameters from 3D Pose for Elderly Care,https://doi.org/10.1145/3375923.3375943
1627,5457,/doi/10.1109/CRV.2014.56,Trinocular Spherical Stereo Vision for Indoor Surveillance,https://doi.org/10.1109/CRV.2014.56
1628,5459,/doi/10.1016/j.inffus.2010.06.002,Information fusion to detect and classify pedestrians using invariant features,https://doi.org/10.1016/j.inffus.2010.06.002
1629,5462,/doi/10.1007/978-3-540-69057-3_100,Gesture Recognition with Hidden Markov Models to Enable Multi-modal Haptic Feedback,https://doi.org/10.1007/978-3-540-69057-3_100
1630,5465,/doi/10.1007/978-3-642-14064-8_1,Efficient Bimodal Haptic Weight Actuation,https://doi.org/10.1007/978-3-642-14064-8_1
1631,5466,/doi/10.1007/978-3-642-02809-0_46,A Contribution to Integrated Driver Modeling: A Coherent Framework for Modeling Both Non-routine and Routine Elements of the Driving Task,https://doi.org/10.1007/978-3-642-02809-0_46
1632,5469,/doi/10.1162/pres.16.5.471,Human Factors Issues on the Design of Telepresence Systems,https://doi.org/10.1162/pres.16.5.471
1633,5470,/doi/10.1162/105474604774048207,"A study on visual, auditory, and haptic feedback for assembly tasks",https://doi.org/10.1162/105474604774048207
1634,5477,/doi/10.1007/s10994-023-06439-1,Learning de-biased regression trees and forests from complex samples,https://doi.org/10.1007/s10994-023-06439-1
1635,5480,/doi/10.1007/978-3-031-33498-6_2,Multi-target Decision Making Under Conditions of Severe Uncertainty,https://doi.org/10.1007/978-3-031-33498-6_2
1636,5483,/doi/10.1007/978-3-031-18843-5_18,Levelwise Data Disambiguation by Cautious Superset Classification,https://doi.org/10.1007/978-3-031-18843-5_18
1637,5486,/doi/10.1016/j.ijar.2022.01.016,Information efficient learning of complexly structured preferences: Elicitation procedures and their application to decision making under uncertainty,https://doi.org/10.1016/j.ijar.2022.01.016
1638,5488,/doi/10.1007/978-3-030-98018-4_8,Accounting for Gaussian Process Imprecision in Bayesian Optimization,https://doi.org/10.1007/978-3-030-98018-4_8
1639,5489,/doi/10.1007/s11634-020-00428-1,Adapted single-cell consensus clustering (adaSC3),https://doi.org/10.1007/s11634-020-00428-1
1640,5492,/doi/10.1007/978-3-030-58449-8_18,Undecided Voters as Set-Valued Information – Towards Forecasts Under Epistemic Imprecision,https://doi.org/10.1007/978-3-030-58449-8_18
1641,5493,/doi/10.1016/j.ijar.2019.09.006,Estimation of classification probabilities in small domains accounting for nonresponse relying on imprecise probability,https://doi.org/10.1016/j.ijar.2019.09.006
1642,5495,/doi/10.1016/j.ijar.2014.07.003,Statistical modeling under partial identification,https://doi.org/10.1016/j.ijar.2014.07.003
1643,5496,/doi/10.1016/j.ijar.2012.06.013,Partially identified prevalence estimation under misclassification using the kappa coefficient,https://doi.org/10.1016/j.ijar.2012.06.013
1644,5499,/doi/10.1016/j.ijar.2010.08.001,Editorial: Imprecise probability in statistical inference and decision making,https://doi.org/10.1016/j.ijar.2010.08.001
1645,5503,/doi/10.1016/j.ijar.2009.02.009,Editorial: Imprecise probability models and their applications,https://doi.org/10.1016/j.ijar.2009.02.009
1646,5506,/doi/10.1016/j.ijar.2008.03.011,A nonparametric predictive alternative to the Imprecise Dirichlet Model: The case of a known number of categories,https://doi.org/10.1016/j.ijar.2008.03.011
1647,5507,/doi/10.1016/j.ijar.2008.03.018,Bayesian learning for a class of priors with prescribed marginals,https://doi.org/10.1016/j.ijar.2008.03.018
1648,5510,/doi/10.1016/j.ijar.2006.07.016,Decision making under incomplete data using the imprecise Dirichlet model,https://doi.org/10.1016/j.ijar.2006.07.016
1649,5512,/doi/10.1016/j.neunet.2023.02.005,Neural network model for imprecise regression with interval dependent variables,https://doi.org/10.1016/j.neunet.2023.02.005
1650,5515,/doi/10.1016/j.ijar.2023.02.007,Should data ever be thrown away? Pooling interval-censored data sets with different precision,https://doi.org/10.1016/j.ijar.2023.02.007
1651,5516,/doi/10.1016/j.ijar.2023.109044,Verified propagation of imprecise probabilities in non-linear ODEs,https://doi.org/10.1016/j.ijar.2023.109044
1652,5521,/doi/10.4018/IJDSST.2021010103,A Collaborative Decision Support System Framework for Vertical Farming Business Developments,https://doi.org/10.4018/IJDSST.2021010103
1653,5524,/doi/10.1016/j.ijar.2023.108951,Towards an automatic uncertainty compiler,https://doi.org/10.1016/j.ijar.2023.108951
1654,5527,/doi/10.1016/j.ijar.2014.11.003,Natural language of uncertainty,https://doi.org/10.1016/j.ijar.2014.11.003
1655,5535,/doi/10.1016/j.envsoft.2012.05.009,Short communication: Commentary: IUCN classifications under uncertainty,https://doi.org/10.1016/j.envsoft.2012.05.009
1656,5541,/doi/10.1016/j.ijar.2009.06.013,Trade-off between sample size and accuracy: Case of measurements under interval uncertainty,https://doi.org/10.1016/j.ijar.2009.06.013
1657,5545,/doi/10.1016/j.cam.2005.07.041,"Interval versions of statistical techniques with applications to environmental analysis, bioinformatics, and privacy in statistical databases",https://doi.org/10.1016/j.cam.2005.07.041
1658,5553,/doi/10.1109/SCAN.2006.7,"Adding Constraints to Situations When, In Addition to Intervals,We Also Have Partial Information about Probabilities",https://doi.org/10.1109/SCAN.2006.7
1659,5556,/doi/10.1016/j.ijar.2005.06.009,Computing best-possible bounds for the distribution of a sum of several variables is NP-hard,https://doi.org/10.1016/j.ijar.2005.06.009
1660,5557,/doi/10.1145/564585.564604,Computing variance for interval data is NP-hard,https://doi.org/10.1145/564585.564604
1661,5560,/doi/10.1007/978-3-031-46002-9_14,The Inverse Problem for Neural Networks,https://doi.org/10.1007/978-3-031-46002-9_14
1662,5561,/doi/10.1016/j.ic.2022.104937,Decomposing reach set computations with low-dimensional sets and high-dimensional matrices (extended version),https://doi.org/10.1016/j.ic.2022.104937
1663,5565,/doi/10.1007/978-3-031-07727-2_9,Conservative Time Discretization: A Comparative Study,https://doi.org/10.1007/978-3-031-07727-2_9
1664,5566,/doi/10.1016/j.compstruc.2021.106699,Combining set propagation with finite element methods for time integration in transient solid mechanics problems,https://doi.org/10.1016/j.compstruc.2021.106699
1665,5569,/doi/10.1007/978-3-030-89716-1_6,Reachability of Weakly Nonlinear Systems Using Carleman Linearization,https://doi.org/10.1007/978-3-030-89716-1_6
1666,5570,/doi/10.1007/978-3-030-61739-4_4,Case Study: Reachability and Scalability in a Unified Combat-Command-and-Control Model,https://doi.org/10.1007/978-3-030-61739-4_4
1667,5572,/doi/10.1145/3302504.3311804,JuliaReach: a toolbox for set-based reachability,https://doi.org/10.1145/3302504.3311804
1668,5573,/doi/10.1145/3641513.3650141,Falsification using Reachability of Surrogate Koopman Models,https://doi.org/10.1145/3641513.3650141
1669,5580,/doi/10.1007/978-3-031-45332-8_12,AutoKoopman: A Toolbox for Automated System Identification via Koopman Operator Linearization,https://doi.org/10.1007/978-3-031-45332-8_12
1670,5582,/doi/10.1145/3524052,A Refinement-based Formal Development of Cyber-physical Railway Signalling Systems,https://doi.org/10.1145/3524052
1671,5588,/doi/10.1007/978-3-031-19762-8_10,Data-Driven Reachability Analysis of Digital Twin FMI Models,https://doi.org/10.1007/978-3-031-19762-8_10
1672,5591,/doi/10.1109/ITSC55140.2022.9922294,Runtime Assurance for Autonomous Driving with Neural Reachability,https://doi.org/10.1109/ITSC55140.2022.9922294
1673,5594,/doi/10.1007/978-3-031-13185-1_24,Reachability of Koopman Linearized Systems Using Random Fourier Feature Observables and Polynomial Zonotope Refinement,https://doi.org/10.1007/978-3-031-13185-1_24
1674,5595,/doi/10.1007/978-3-031-07727-2_7,Reachability Analysis and Simulation for Hybridised Event-B Models,https://doi.org/10.1007/978-3-031-07727-2_7
1675,5597,/doi/10.1007/978-3-030-57628-8_16,Reachability Analysis of Nonlinear Systems Using Hybridization and Dynamics Scaling,https://doi.org/10.1007/978-3-030-57628-8_16
1676,5599,/doi/10.1007/s10009-018-0485-6,Parallel reachability analysis of hybrid systems in XSpeed,https://doi.org/10.1007/s10009-018-0485-6
1677,5604,/doi/10.1145/3302504.3311813,Falsification of hybrid systems using symbolic reachability and trajectory splicing,https://doi.org/10.1145/3302504.3311813
1678,5606,/doi/10.1007/s10009-017-0458-1,Hybrid automata: from verification to implementation,https://doi.org/10.1007/s10009-017-0458-1
1679,5610,/doi/10.1145/3178126.3178128,Reach Set Approximation through Decomposition with Low-dimensional Sets and High-dimensional Matrices,https://doi.org/10.1145/3178126.3178128
1680,5612,/doi/10.1007/978-3-662-54577-5_34,Counterexample-Guided Refinement of Template Polyhedra,https://doi.org/10.1007/978-3-662-54577-5_34
1681,5615,/doi/10.1145/3049797.3049814,Safety Verification of Nonlinear Hybrid Systems Based on Invariant Clusters,https://doi.org/10.1145/3049797.3049814
1682,5619,/doi/10.1007/s10009-015-0393-y,Guided search for hybrid systems based on coarse-grained space abstractions,https://doi.org/10.1007/s10009-015-0393-y
1683,5623,/doi/10.1145/2883817.2883837,Scalable Static Hybridization Methods for Analysis of Nonlinear Systems,https://doi.org/10.1145/2883817.2883837
1684,5625,/doi/10.1145/2728606.2728650,HyRG: a random generation tool for affine hybrid automata,https://doi.org/10.1145/2728606.2728650
1685,5626,/doi/10.1145/2728606.2728630,HYST: a source transformation and translation tool for hybrid automaton models,https://doi.org/10.1145/2728606.2728630
1686,5627,/doi/10.1145/2728606.2728622,Eliminating spurious transitions in reachability with support functions,https://doi.org/10.1145/2728606.2728622
1687,5630,/doi/10.1145/2562059.2562142,Quasi-dependent variables in hybrid automata,https://doi.org/10.1145/2562059.2562142
1688,5634,/doi/10.1007/978-3-642-31424-7_35,A box-based distance between regions for guiding the reachability analysis of spaceex,https://doi.org/10.1007/978-3-642-31424-7_35
1689,5635,/doi/10.1016/j.camwa.2023.10.011,Solver algorithm for stabilized space-time formulation of advection-dominated diffusion problem,https://doi.org/10.1016/j.camwa.2023.10.011
1690,5638,/doi/10.1016/j.camwa.2023.09.035,Fast parallel IGA-ADS solver for time-dependent Maxwell's equations,https://doi.org/10.1016/j.camwa.2023.09.035
1691,5642,/doi/10.1016/j.cam.2023.115141,Stability of non-linear flow in heterogeneous porous media simulations using higher order and continuity basis functions,https://doi.org/10.1016/j.cam.2023.115141
1692,5643,/doi/10.1016/j.camwa.2023.04.043,A Kronecker product linear-cost solver for the high-order generalized-α method for multi-dimensional hyperbolic systems,https://doi.org/10.1016/j.camwa.2023.04.043
1693,5646,/doi/10.1016/j.camwa.2023.04.023,Quasi-optimal hp-finite element refinements towards singularities via deep neural network prediction,https://doi.org/10.1016/j.camwa.2023.04.023
